post_id,user_id,body,created_ts,visibility
100534,1254,Performance policy challenge cold evening. Professor certainly little necessary reveal senior agreement. Enjoy night week along late.,2020-12-07T03:39:05,followers
100535,1039,Reveal break physical world. Evening debate sense result.,2020-01-02T22:36:54,private
100536,1046,Temporibus molestiae suscipit quas molestiae voluptates. Error eos est.,2020-07-24T09:18:31,private
100537,1304,City police conference cause like hospital. Mission could like.,2020-07-12T01:48:05,public
100538,1377,Enim earum libero voluptates placeat explicabo aperiam. Vero eveniet sequi quo quo.,2020-06-25T16:48:21,followers
100539,1343,Nesciunt dolores consequuntur dolorem. Asperiores optio illo. Expedita accusantium repellendus est placeat.,2020-09-06T13:09:29,followers
100540,1434,Knowledge Republican loss response bad. Part group rest model ask painting them body. Various rise discussion.,2020-09-22T03:23:07,followers
100541,1266,Totam soluta ullam minima saepe recusandae incidunt impedit. Adipisci harum dolores repudiandae autem. Quisquam optio aperiam culpa libero ab.,2020-02-28T01:29:11,public
100542,1248,Voluptatem beatae cum voluptas nisi. Repellendus illum quia at deleniti dolorem voluptatum officia. Adipisci aliquid debitis asperiores voluptates vitae. Explicabo dignissimos quidem quod harum reiciendis.,2020-04-30T18:32:19,private
100543,1076,A quae minus fugit numquam dolor vitae. Accusamus nostrum facilis recusandae laboriosam sunt. Aliquid veritatis fugit dicta provident doloremque expedita.,2020-08-17T13:20:56,private
100544,1139,Odit odio repellat repellendus dolorum iure fugit. Magni vitae quasi quos quibusdam minima ducimus. Non doloribus labore fugiat soluta error.,2020-05-20T11:09:12,public
100545,1214,Sound record section view early what speech. Standard according member relate standard writer. We real may theory.,2020-07-11T14:50:59,followers
100546,1154,Aliquid aut sint. Quis quaerat quas harum a exercitationem.,2020-07-18T23:19:33,public
100547,1032,Architecto quo nulla. Sit sequi in iure quas nam. Natus beatae optio.,2020-08-07T04:56:49,followers
100548,1095,Saepe saepe molestiae nobis deleniti.,2020-06-29T16:45:27,public
100549,1196,Officia cupiditate accusamus. Culpa enim earum assumenda dicta.,2020-10-07T22:27:41,public
100550,1249,Quae adipisci quas sunt error. Reprehenderit aperiam nobis. Soluta vitae recusandae quisquam accusamus harum optio.,2020-11-13T15:11:33,public
100551,1042,Ab ratione ipsa vero odio dolore inventore adipisci. Cum tenetur accusantium dolorem quam culpa esse.,2020-10-13T12:48:05,private
100552,1401,Porro aperiam vitae. Voluptas commodi accusantium reprehenderit amet quia animi. Sint quam placeat ipsum.,2020-01-14T03:52:30,private
100553,1327,Employee bill woman girl offer glass heavy. Later pressure end realize hear campaign eight.,2020-03-02T17:36:03,public
100554,1275,Use almost respond set. Agency ask sometimes ahead. Figure professional believe director agree.,2020-02-07T04:39:12,public
100555,1106,Ea error sequi ad nam. Culpa nesciunt ipsa quae.,2020-11-19T21:55:13,followers
100556,1094,Technology suddenly place west. Guess event hear give lose sing. Require skin threat and hundred follow.,2020-02-14T05:29:16,followers
100557,1399,Note cost forget expert however wrong.,2020-03-29T20:18:58,private
100558,1420,Autem dicta ipsam.,2020-09-06T00:03:30,public
100559,1328,Blanditiis pariatur animi debitis quibusdam. Commodi reiciendis cum assumenda. Perspiciatis molestias cumque temporibus.,2020-11-27T20:36:33,private
100560,1484,Adipisci et est nulla. Tempore qui odio.,2020-11-16T05:57:07,followers
100561,1140,Molestias nihil repudiandae enim omnis repellat iure. Libero eaque ipsum perferendis laudantium.,2020-03-23T19:17:40,private
100562,1298,Illum sapiente commodi recusandae. Recusandae animi tempore aliquid. Facere suscipit occaecati qui quod cupiditate sit.,2020-09-22T05:14:44,public
100563,1192,Name and could avoid property reveal ready. Final religious work far or better. Develop base watch sign upon source provide.,2020-10-30T12:48:08,public
100564,1497,Animi ex numquam. Est deleniti nihil delectus deserunt dolores culpa maiores.,2020-01-16T01:47:46,followers
100565,1337,Program involve baby threat. Discover little ground board sign law hear.,2020-11-29T15:50:20,private
100566,1181,Occaecati iusto ullam enim hic. Harum a repellat natus consectetur. Ullam vitae corrupti quo assumenda cupiditate eligendi. Sequi adipisci facilis esse deserunt quaerat.,2020-03-10T02:22:08,followers
100567,1353,Dolores consequatur accusantium. Eos fuga ipsam consequuntur labore illo veniam vero.,2020-08-08T08:43:07,followers
100568,1200,Saepe exercitationem aperiam praesentium voluptatem. Porro quibusdam eius voluptatem.,2020-03-06T11:11:03,followers
100569,1270,Quae magnam eligendi accusantium repellat dolorum. Dolore nihil aut dolorem saepe et eaque. Harum omnis fuga ab.,2020-09-19T20:08:51,public
100570,1315,In ullam atque alias quasi. Excepturi quae aperiam impedit fugit vitae. Totam accusantium exercitationem fugit blanditiis cupiditate.,2020-05-31T00:36:13,followers
100571,1082,Sunt cumque illum nulla. Voluptatum aliquid laboriosam sapiente molestias praesentium veritatis.,2020-12-16T07:48:55,followers
100572,1215,Generation owner do or floor second.,2020-12-15T00:48:29,followers
100573,1261,Sit porro dolore. Quam repellendus ipsum animi officiis repellat ipsam earum.,2020-06-07T07:33:12,followers
100574,1192,Assumenda similique sapiente repellendus ab saepe. Illo id minima sequi ex perspiciatis.,2020-08-03T01:06:32,private
100575,1028,Unde debitis expedita eum voluptate dicta earum. Veniam ut quidem iste eligendi voluptatum.,2020-10-06T06:36:40,public
100576,1070,List town half. Head help build reveal story though soldier.,2020-06-13T14:08:44,private
100577,1104,Material election herself. Nothing eight way candidate.,2020-05-21T03:23:32,followers
100578,1236,Should range agent experience government officer loss. Game style see dinner generation medical. Big real often stuff score.,2020-11-18T21:35:38,public
100579,1054,Cup threat view stay minute rock character population.,2020-03-13T08:01:43,private
100580,1088,Numquam iste veniam impedit consectetur reprehenderit voluptatibus. Sed quibusdam vero sit adipisci fuga consequatur eum.,2020-12-30T10:14:22,private
100581,1006,Et occaecati corporis enim. Fugiat explicabo inventore pariatur cumque. Similique aut expedita dolore unde eos quasi.,2020-05-29T22:50:20,private
100582,1403,Head sing guy eight contain simple. Miss lay feeling collection quickly one music. Century exist mother degree.,2020-01-19T20:53:37,followers
100583,1212,Ullam pariatur quam. Qui placeat commodi adipisci sapiente. Delectus explicabo in reiciendis sit illum corporis.,2020-08-02T23:30:40,public
100584,1448,Quisquam magnam atque. Odio dolore fuga maxime cupiditate fuga.,2020-08-02T12:11:46,private
100585,1261,Distinctio saepe consequatur minima dolorem minima suscipit. Nobis iusto alias eligendi molestias. Quae eos labore.,2020-03-26T06:02:23,private
100586,1007,Dolor perferendis nulla fugiat repellendus quisquam tempore. Voluptas asperiores nam quas molestias ut.,2020-05-01T19:16:43,public
100587,1464,Delectus quidem est sapiente tenetur. Esse in numquam fuga ipsum nemo.,2020-09-19T08:21:25,public
100588,1119,Est quae praesentium recusandae. Voluptatem sapiente cumque sapiente vel quibusdam debitis. Voluptate explicabo aperiam aliquid animi maxime eveniet.,2020-05-05T16:41:07,public
100589,1139,May case wear decide put can indicate. Fine fund number someone next past. Customer choose music others indeed ten more.,2020-10-07T17:37:56,followers
100590,1498,Expedita eius ipsa debitis aperiam numquam soluta. Reprehenderit et doloremque accusamus. Veniam facilis repellendus cum pariatur quo quae.,2020-05-27T18:21:00,followers
100591,1205,Qui laborum blanditiis saepe esse autem. Eius dolor perferendis aspernatur. Ratione libero officia cumque in.,2020-09-07T06:23:27,public
100592,1312,In veritatis alias. Saepe fugiat unde mollitia totam sed pariatur deserunt.,2020-08-24T03:42:17,public
100593,1179,Fugiat amet mollitia nostrum ipsa. Ratione et deserunt iure a aliquam voluptatibus provident.,2020-08-23T14:57:02,followers
100594,1228,Dolorum nulla velit dignissimos temporibus. Voluptatum dolore laudantium dolor cum.,2020-07-17T01:44:01,followers
100595,1143,Quis rem maiores fugit deleniti doloribus. Ad aperiam voluptas consequatur placeat.,2020-01-28T05:40:55,private
100596,1169,Expedita tempora culpa expedita voluptatibus. Natus molestias labore tempora nisi cumque. Reiciendis repellendus totam assumenda ex consectetur eius.,2020-09-13T04:31:51,followers
100597,1349,Dolorum illo ea ducimus cupiditate alias ad. Qui iste modi repudiandae ab iusto.,2020-08-09T00:59:15,private
100598,1152,Tempore soluta consectetur. Earum dolore ipsa officia doloribus. Sint sint dolorem iure cumque.,2020-07-06T04:02:30,followers
100599,1036,Provident fugiat placeat ducimus repellendus exercitationem natus. Nihil labore iusto culpa. Nemo corporis quidem architecto quos.,2020-06-10T02:32:16,followers
100600,1153,Vel provident provident ullam aliquid. Accusamus harum recusandae quis inventore dolores magni. Autem quidem soluta eos alias minus.,2020-06-27T18:35:39,followers
100601,1272,Mollitia eligendi commodi soluta quam voluptatibus. Excepturi rem iure officia non optio ullam.,2020-05-04T12:11:09,followers
100602,1157,Eveniet omnis laboriosam. A explicabo nostrum voluptatibus nobis. Sapiente repellendus voluptatem deleniti eveniet.,2020-11-27T15:14:04,private
100603,1038,Quia architecto alias nihil cumque necessitatibus. Similique libero eaque reprehenderit itaque. Minus laudantium nihil blanditiis. Eveniet deserunt voluptate ad cupiditate.,2020-12-24T13:25:48,followers
100604,1141,Mollitia laudantium rerum tempore quibusdam. Beatae temporibus ratione accusamus voluptatibus iusto. Voluptate voluptatum optio voluptatum molestias cupiditate reiciendis alias.,2020-06-20T12:16:07,public
100605,1011,Perspiciatis aliquid deserunt quo beatae. Quidem eum incidunt porro deleniti. Recusandae itaque quibusdam incidunt.,2020-02-29T01:41:46,private
100606,1012,Maiores consectetur eaque consectetur eos adipisci. Maxime molestiae quidem totam ipsum occaecati. Accusamus odio tenetur error molestias nisi.,2020-05-06T13:28:25,private
100607,1470,Quo illum dolorum eum molestiae magni id. Facere nulla aliquid recusandae voluptatem vero praesentium.,2020-04-07T22:43:02,public
100608,1206,Odio saepe vitae pariatur asperiores. Nulla ea ratione sed consequuntur doloribus dolore.,2020-11-14T14:56:46,public
100609,1446,Politics market mouth reflect trip. Man research word he season large ready. Most president surface garden a through college.,2020-02-28T15:56:24,followers
100610,1348,Consectetur quia sapiente omnis officiis soluta quidem. Omnis mollitia deserunt eius sunt.,2020-08-17T09:53:19,private
100611,1202,Fugiat velit excepturi harum cum. Molestiae laboriosam animi veniam.,2020-05-19T11:41:50,followers
100612,1184,Impedit eum pariatur minus culpa excepturi assumenda fuga. Itaque sint alias sequi vitae temporibus dolor ea. Natus quam est dolor.,2020-02-21T10:57:49,public
100613,1188,Et saepe eum magni aliquam reiciendis. Quae quasi debitis fuga provident commodi corrupti et. Quibusdam temporibus cupiditate tenetur sunt.,2020-02-25T08:12:50,private
100614,1416,Repellat quia odit accusantium qui. Inventore assumenda maxime necessitatibus. Quia in excepturi nobis incidunt ducimus sint.,2020-03-14T04:47:25,private
100615,1465,Earum ducimus delectus rem eum veritatis repellat. A dicta est veniam omnis ipsam rem. Voluptatem aperiam laborum animi alias deleniti.,2020-09-19T16:46:38,private
100616,1158,Commodi laudantium quia aspernatur quasi temporibus. Laudantium aspernatur veritatis quas. Quam iusto cumque tempora error ratione animi.,2020-04-17T01:38:13,private
100617,1340,Ask affect throughout rest statement unit. Need however analysis record work eat. Energy learn seat baby whom.,2020-07-26T03:21:22,followers
100618,1137,Vel et error pariatur molestias ea mollitia. Aliquam at eveniet iusto ab natus.,2020-01-05T02:59:02,private
100619,1489,Vel ratione atque. Enim vero iste quibusdam molestias consequatur.,2020-07-21T07:02:56,followers
100620,1499,Numquam et fugit. Facilis necessitatibus explicabo placeat ratione corporis. Eum maiores incidunt vero non nisi odit voluptates.,2020-12-10T18:09:53,private
100621,1469,Nemo ullam corrupti quibusdam fuga pariatur vitae iusto. Quam minima beatae earum mollitia sint praesentium.,2020-03-06T10:42:30,public
100622,1062,Molestias eum itaque similique quaerat quas repellat. Eos sapiente nulla magnam ea. Dolorem error aliquam ut accusamus nostrum.,2020-12-04T23:37:22,private
100623,1377,Exercitationem magni velit reprehenderit. Ullam earum aliquam ipsam cumque quaerat quod. Voluptatem similique magnam culpa veniam rerum.,2020-01-30T01:42:52,private
100624,1023,Small ago there building Democrat. Else push how provide difficult tax why.,2020-12-20T19:57:17,public
100625,1363,Rem expedita non id maxime. Nam quam mollitia distinctio labore maiores rem.,2020-02-20T20:13:29,public
100626,1477,Autem voluptate blanditiis nesciunt. Quis sed dolores voluptatibus assumenda mollitia. Nulla blanditiis saepe amet repellendus quod est. Consequatur dicta iure ex placeat.,2020-02-23T17:48:48,followers
100627,1348,Quam quisquam natus excepturi. Omnis reiciendis perferendis deserunt eveniet veritatis eius.,2020-03-24T23:20:44,private
100628,1028,Discover fact tell some cause. On town simple say whom hair. Cost admit least place. Age firm indicate position page test.,2020-09-07T10:04:05,public
100629,1292,Soluta tempora cumque voluptas architecto voluptatum mollitia ab. Natus sapiente debitis.,2020-08-22T10:31:09,private
100630,1356,Rem debitis maxime veniam impedit architecto. Exercitationem unde quo voluptate laboriosam ad repellendus.,2020-06-28T23:07:15,private
100631,1021,Voluptas adipisci accusantium. Saepe hic ad mollitia architecto consequatur incidunt. Fugiat laboriosam minima eos ipsum.,2020-05-07T01:04:59,followers
100632,1242,Saepe accusantium necessitatibus. Quia accusantium voluptas ipsam. A sequi sapiente aliquam.,2020-02-24T01:13:25,private
100633,1077,Doloribus et dicta earum magnam minima accusamus. Excepturi quaerat quis.,2020-01-31T20:14:38,private
100634,1045,Temporibus labore itaque dolorum cumque veritatis. Sunt commodi eos occaecati doloremque. Maxime reprehenderit numquam assumenda placeat consequatur. Mollitia similique ea hic ullam possimus nihil.,2020-02-18T18:18:13,followers
100635,1185,Praesentium vitae odio laudantium tempora. In itaque sed ullam.,2020-10-30T08:46:38,followers
100636,1175,Aliquid possimus reprehenderit numquam alias dolore nisi. Accusantium ipsa officiis reiciendis inventore qui nostrum. Cupiditate optio sit voluptatum eum libero velit.,2020-05-01T06:32:42,followers
100637,1055,Quibusdam occaecati voluptatum ut reiciendis. Mollitia libero enim. Laboriosam neque optio vitae nesciunt eaque aliquam similique. Doloribus expedita maiores doloribus soluta dolores.,2020-12-20T18:32:57,followers
100638,1472,Illum culpa excepturi. Animi facilis iure.,2020-06-30T23:27:11,public
100639,1292,Eos impedit distinctio quibusdam optio enim ipsam nemo.,2020-11-26T04:07:39,followers
100640,1342,Laborum vel aliquid. Doloremque sequi deleniti voluptatum totam animi. Aut quae tempora laboriosam commodi.,2020-02-02T14:35:43,followers
100641,1187,Unde hic ducimus tenetur eum vero. Nobis sapiente ut.,2020-11-27T04:18:52,followers
100642,1283,Explicabo fugit sint ea magni necessitatibus. Incidunt labore deleniti distinctio. Modi atque nesciunt rem fugit blanditiis.,2020-04-08T21:19:44,private
100643,1430,Perferendis quidem non odio unde.,2020-11-24T21:45:09,private
100644,1080,Minima atque dicta voluptatum. Odio hic maxime placeat numquam. Adipisci repudiandae voluptates minima nihil voluptatem odit aliquid.,2020-11-06T21:27:12,private
100645,1397,Consectetur dolor sed aliquam deleniti hic labore. Delectus culpa quidem eius est beatae quidem. Quis illo fugit.,2020-03-16T17:41:43,public
100646,1129,Libero iusto nesciunt quis voluptates. Doloremque dolor tempore excepturi. Libero dicta perferendis quidem. Quaerat architecto doloribus a sint.,2020-04-09T18:22:50,followers
100647,1492,Quidem voluptates sed deserunt.,2020-05-11T08:40:17,public
100648,1497,Consectetur perspiciatis maiores incidunt quisquam deleniti molestiae. Dolor dolorem assumenda distinctio optio earum. Eveniet consequuntur est necessitatibus earum.,2020-10-24T17:44:02,followers
100649,1193,Voluptatem labore debitis id minima vel doloribus. In tenetur hic quas mollitia.,2020-10-02T17:02:17,private
100650,1483,Error dolorum inventore id. Recusandae quasi est veritatis.,2020-11-06T17:53:24,public
100651,1131,Quod excepturi non mollitia. Beatae ut ipsum ullam minima distinctio. Harum pariatur accusamus nostrum consectetur voluptatibus.,2020-08-10T07:25:11,public
100652,1274,Ipsam ut assumenda reprehenderit ullam. Perferendis ad commodi.,2020-12-11T01:29:34,public
100653,1015,Mollitia odit dolore. Aperiam quod alias.,2020-04-05T08:35:42,public
100654,1117,Cost sometimes hit present respond. Sing surface value. Learn probably commercial science eye generation.,2020-12-03T15:52:20,followers
100655,1460,Ability program scene quality American. Task various citizen compare easy simply. Real coach herself create.,2020-07-10T08:32:53,public
100656,1186,Soluta id eos quasi laboriosam iste sunt. Quasi illo perferendis voluptate quidem. Officia totam voluptas libero unde magnam reprehenderit.,2020-01-25T00:35:45,followers
100657,1459,Laborum aut velit enim corrupti. Magnam impedit sed aut impedit ipsum.,2020-04-19T23:14:42,private
100658,1131,Painting hard word final reality evidence. Keep call rise different more.,2020-06-21T04:15:00,public
100659,1225,Exist these bed night. Another tonight series under nor. Thought increase set ok finish difference single value.,2020-10-02T05:53:49,private
100660,1146,Environmental send ago this town enough agent. Clear blue possible receive international hair. Mouth only team.,2020-11-12T10:05:09,followers
100661,1289,Voluptate ad sunt eaque non aliquid eos error. Doloribus illum odio.,2020-06-04T02:57:36,public
100662,1333,A laboriosam explicabo officiis quam dolorum voluptatibus nam. Et quod eligendi asperiores quibusdam corporis omnis. Vitae reiciendis beatae iure incidunt incidunt. Hic pariatur inventore a voluptatem praesentium.,2020-04-17T13:50:27,public
100663,1381,Praesentium nihil consequatur quaerat aut unde. Dignissimos aut est dicta expedita libero deserunt.,2020-05-29T23:24:14,private
100664,1098,Voluptatibus repellat quidem non repellendus incidunt. Repudiandae aspernatur dolore labore laboriosam.,2020-12-16T01:34:32,private
100665,1129,Cum dolore dolor molestias eveniet ipsum. Modi dolore magnam ea qui commodi. Harum asperiores at necessitatibus cum cum. Sint enim voluptatum sit porro doloremque.,2020-03-08T17:46:16,private
100666,1499,Ratione fugit sint totam. Voluptates repellendus facere pariatur ratione tenetur occaecati earum.,2020-12-26T22:11:16,public
100667,1471,Pariatur dolor quasi voluptate iure perspiciatis dolores iste.,2020-02-10T10:34:04,followers
100668,1038,Similique quidem omnis eveniet dolores. Soluta qui qui officiis optio fugiat esse. Expedita consectetur voluptatum consectetur repellendus vero sequi adipisci.,2020-12-08T17:04:39,private
100669,1189,Player eye allow ability writer upon.,2020-04-03T12:58:03,private
100670,1241,Facere dolores repellat voluptatibus. Perspiciatis impedit iste sunt quas praesentium. Exercitationem laboriosam aliquid impedit.,2020-08-02T07:54:11,followers
100671,1232,Enim assumenda quod praesentium. Nemo debitis laudantium alias. Eum quo harum voluptatum.,2020-07-13T13:19:14,public
100672,1427,Possimus ullam laudantium fugiat ducimus itaque ea. Delectus ut dolor magni animi expedita. Quam veritatis eaque dicta repellat sapiente architecto.,2020-08-17T14:51:19,private
100673,1230,Officiis eos voluptates possimus nostrum. Quidem commodi praesentium quas totam aliquid nisi.,2020-05-06T13:20:08,followers
100674,1491,Fuga corrupti molestiae fugit unde sapiente.,2020-06-16T04:10:05,private
100675,1308,Dolorem quos labore ipsa exercitationem amet. Magni temporibus minus quas quo.,2020-01-02T19:31:24,private
100676,1148,At dolorem in accusamus. Enim tempore et doloremque.,2020-07-21T01:30:05,private
100677,1400,Voluptatem natus ut culpa illum quae. Temporibus ullam recusandae hic.,2020-02-07T13:27:34,private
100678,1361,Quam praesentium facere sed dolor.,2020-06-09T11:52:02,public
100679,1122,Reason politics wall assume either agreement name. Court budget source current beyond commercial detail.,2020-06-10T20:57:01,private
100680,1245,Nobis possimus suscipit perferendis laboriosam sequi dolor. Eius molestias dicta minima nulla. Possimus nisi ab eligendi dolorem. At vitae rem.,2020-08-18T14:01:18,private
100681,1086,Later significant help when.,2020-11-10T20:52:28,followers
100682,1051,Harum eaque aspernatur voluptas repudiandae illum. Earum tempore fugiat. Est temporibus molestiae.,2020-11-23T18:25:00,private
100683,1360,Provident nam error rerum neque et cumque. Sint dolorem facere voluptas voluptatibus facere quos. Debitis doloribus veritatis modi ratione corporis non veritatis. Deserunt ipsum explicabo illo natus.,2020-11-12T12:06:51,followers
100684,1274,Ratione praesentium perferendis eum in ad temporibus. Nisi dolores officiis mollitia perspiciatis. Illo ut minima rerum laborum.,2020-04-28T04:12:17,private
100685,1369,Sequi rem totam doloremque soluta commodi. Nihil sapiente qui nulla officiis necessitatibus. Rerum inventore numquam dolore id eveniet dolor.,2020-07-26T05:47:51,private
100686,1196,Ad delectus earum. Vel laudantium incidunt voluptas.,2020-03-03T11:13:34,public
100687,1228,Repellat provident doloribus sed. Nemo adipisci aliquam vel quae excepturi cum facilis. Repudiandae ipsam voluptas iste itaque maiores ipsum officiis.,2020-01-27T20:22:34,followers
100688,1054,Placeat dignissimos animi sit deserunt ut voluptatum.,2020-11-22T18:17:31,private
100689,1486,Voluptatem delectus illo quos omnis. Nulla magni corporis amet amet. Iure dolore error ex similique nemo.,2020-11-02T19:30:36,followers
100690,1090,Explicabo fuga nisi maiores dignissimos. Necessitatibus iusto laborum voluptate quo laudantium distinctio. Optio provident beatae autem vitae illo. Perferendis eaque quas a tempore architecto quos laudantium.,2020-01-23T01:28:11,private
100691,1191,Asperiores autem aut nisi ab. Porro impedit magnam repudiandae quisquam. Doloribus sint voluptatem dolore eaque quis.,2020-07-31T12:12:29,private
100692,1499,Facere molestias temporibus. Vitae temporibus adipisci nihil esse molestias similique fugit. Neque totam asperiores sequi. Vero dolores veritatis dolor magni culpa.,2020-08-04T11:45:44,public
100693,1161,Tenetur cumque vel mollitia. In placeat eum accusamus architecto.,2020-05-12T23:58:07,public
100694,1495,Vel inventore nobis deserunt. Magnam iure dignissimos tenetur odit suscipit eos delectus. Quisquam accusantium vitae.,2020-11-01T19:23:57,followers
100695,1344,Nemo perferendis sit consectetur aperiam. Reprehenderit beatae hic blanditiis rem labore.,2020-08-22T22:10:27,followers
100696,1293,Ex quis consequatur doloremque iure ipsam officia. Nemo qui incidunt iusto deleniti sapiente laudantium. Quae fugiat similique earum.,2020-07-29T03:27:06,public
100697,1385,Dignissimos veniam et vero molestiae. At sapiente asperiores natus ducimus.,2020-02-09T10:41:54,followers
100698,1036,Ea sequi libero labore ducimus nulla. Impedit aliquam ab dolorem natus nesciunt error. Ex quisquam deserunt dolore illum consequuntur consequuntur.,2020-04-27T06:38:25,public
100699,1168,Even stuff training pretty notice both. Gas answer arrive account step. Series statement daughter government entire past.,2020-09-04T14:44:01,public
100700,1356,Accusamus id odit explicabo. Natus at accusamus.,2020-12-30T21:15:48,followers
100701,1199,Placeat fuga deleniti ducimus dignissimos perspiciatis dolore. Ad nisi molestias soluta corporis velit autem accusantium. Quaerat commodi sit tempore ducimus.,2020-02-18T01:36:19,private
100702,1321,Ab illo omnis blanditiis modi labore neque. Harum consectetur nulla necessitatibus.,2020-07-17T14:27:22,private
100703,1353,Political site treat her.,2020-01-15T07:50:00,private
100704,1212,Doloribus sapiente accusantium nam perferendis maxime. Unde error mollitia ducimus. Numquam aut temporibus nostrum eligendi.,2020-12-20T15:16:33,public
100705,1299,Excepturi quos aspernatur placeat maxime. Ratione rerum cum harum.,2020-02-26T21:09:03,private
100706,1244,Qui ab laudantium fuga ullam iusto voluptate modi. Consequuntur repellendus enim ex beatae cumque occaecati. Magnam neque officiis cupiditate perspiciatis.,2020-12-19T02:37:58,followers
100707,1183,Politics system people record what. Mouth member clearly protect data. Safe per federal behavior down consider.,2020-03-12T23:01:40,followers
100708,1459,Vero repellendus quidem voluptatem. Necessitatibus natus corporis illo ipsam alias enim.,2020-01-07T23:50:21,public
100709,1027,Ratione impedit quia debitis iste totam debitis. Odit iure totam. Nisi veniam at laudantium perspiciatis placeat cumque.,2020-01-14T20:03:51,public
100710,1303,Quasi error neque nobis molestiae. Dolor ducimus omnis quis.,2020-12-08T12:44:04,followers
100711,1363,Voluptas deleniti nemo saepe. Eligendi voluptatem vitae enim quidem velit rem.,2020-12-13T19:07:47,private
100712,1369,Blanditiis alias distinctio veniam dolorem delectus. Magnam doloremque molestiae odit vitae cumque dolorum. Ipsum quae quas consequatur totam.,2020-09-06T21:57:02,public
