post_id,user_id,body,created_ts,visibility
101438,1095,Fuga quisquam ipsum quod corrupti aut. Asperiores in vero vel alias consequuntur quae.,2020-11-11T08:28:31,followers
101439,1314,Quia tenetur optio sunt. Quidem vitae earum quo. Aut similique eaque. Perspiciatis molestiae nesciunt a provident dignissimos neque.,2020-12-28T23:46:56,public
101440,1468,Sed esse temporibus autem. Ratione excepturi a ab.,2020-04-23T10:42:41,public
101441,1189,Expedita optio neque harum cum laudantium. Explicabo autem odit iusto. Enim quisquam quidem eligendi aspernatur quam commodi.,2020-05-09T07:31:42,followers
101442,1326,Magnam quas dignissimos quod illum quo numquam. Quisquam accusamus voluptate.,2020-06-17T21:37:47,followers
101443,1274,Part how authority. Kitchen remain door maybe probably.,2020-06-25T04:14:10,public
101444,1489,Capital less style past with. Happen some cost money discussion into.,2020-10-15T01:40:43,private
101445,1316,Quibusdam reiciendis recusandae odio recusandae. Similique unde incidunt sunt quidem minus porro. Rem similique possimus nemo ducimus.,2020-08-19T10:03:16,followers
101446,1145,Odio maxime saepe optio eos laboriosam inventore. Expedita rem laudantium molestias sequi necessitatibus. Repellat esse maiores velit doloremque nisi.,2020-10-14T11:45:55,public
101447,1080,Porro vero quam deserunt at tenetur. Perspiciatis laboriosam repudiandae.,2020-03-17T11:44:53,private
101448,1422,Similique quod itaque distinctio atque harum possimus dignissimos. Enim sint maiores quibusdam reprehenderit. Nostrum rerum suscipit perspiciatis.,2020-11-10T17:55:24,followers
101449,1149,Dolores eveniet quisquam quo. Ex mollitia expedita alias. Numquam quos ad.,2020-08-23T18:04:42,public
101450,1260,Already civil beat. Because teach despite finally. You animal change how song together professional.,2020-07-14T11:27:19,private
101451,1431,Impedit consectetur eligendi dolores ad. Voluptatem quisquam quos tempore fugiat atque impedit.,2020-12-14T05:46:31,private
101452,1208,Nihil nulla quidem dignissimos perspiciatis ducimus placeat. Autem dignissimos harum reiciendis rem.,2020-01-03T12:06:32,private
101453,1118,Saepe laudantium tempora nostrum ad praesentium voluptatibus. Iure odit consequuntur cumque.,2020-03-19T01:06:07,private
101454,1052,Pariatur neque animi voluptatibus facere. Assumenda expedita sint enim magni accusantium explicabo. Voluptas mollitia amet officia occaecati dicta quaerat.,2020-07-23T17:03:50,followers
101455,1123,Aut quaerat quam ullam. Ex eligendi odio aspernatur at odio laudantium. Fuga expedita ipsam eum iusto eligendi nisi deserunt.,2020-01-11T08:10:30,private
101456,1013,Eius aut nobis delectus laboriosam voluptate eveniet. Dolore cumque ex distinctio veritatis. Fugit ipsum soluta odio soluta ducimus voluptatibus.,2020-03-15T06:34:02,public
101457,1499,Sunt molestias officiis.,2020-06-10T13:30:26,public
101458,1261,Blanditiis non odio at illo ea illum possimus. Quibusdam dolorem earum necessitatibus quas fugit quibusdam inventore.,2020-03-21T00:37:30,private
101459,1226,Incidunt saepe consequatur in aperiam temporibus. Laborum dicta dicta dolor amet necessitatibus odit perferendis.,2020-08-22T02:59:22,followers
101460,1380,Minus sapiente ab. Consectetur quasi iure voluptatibus aperiam magni nemo porro. Tenetur veniam consequatur impedit delectus accusantium soluta.,2020-05-02T09:19:37,followers
101461,1082,Nulla vitae harum tempore sint incidunt. Doloribus quisquam mollitia voluptatum nisi ab. Odio exercitationem pariatur incidunt eligendi ullam adipisci.,2020-04-01T07:39:23,private
101462,1412,Beyond child hundred some tell.,2020-09-14T00:15:59,private
101463,1424,Nobis corrupti omnis consequuntur cum repellendus voluptatem.,2020-04-29T19:53:07,private
101464,1421,Consequatur quae totam quis reprehenderit. Dolore error nostrum maxime. Laudantium quod dolor minima pariatur tempore deleniti eum.,2020-01-30T10:23:24,public
101465,1427,Fugit consequatur iusto. Impedit dolores quam tempore.,2020-05-13T00:06:32,followers
101466,1060,Autem ab asperiores eaque. Ex aut explicabo. Quaerat quod eius.,2020-12-22T06:35:39,followers
101467,1253,Four window model fall.,2020-08-27T23:50:21,public
101468,1221,Officia consequatur pariatur pariatur. Tempore est nisi natus.,2020-07-19T11:07:30,followers
101469,1091,Hic modi sequi necessitatibus praesentium.,2020-05-17T08:49:06,public
101470,1049,Neque ipsa sed quisquam temporibus. Tempore excepturi a a. Quia blanditiis numquam nemo provident natus.,2020-09-20T10:20:21,private
101471,1057,Ullam commodi facere eligendi repellat. Debitis modi ipsum dolorum fugit cupiditate minima.,2020-09-04T03:53:00,private
101472,1066,Dicta reprehenderit consequuntur quisquam. Voluptas praesentium nobis ipsa blanditiis nemo quidem.,2020-09-23T15:43:06,followers
101473,1073,Alias corrupti nemo laudantium minus iure quibusdam tenetur. Voluptates laborum deserunt earum aspernatur fuga facilis. Ducimus illum vero excepturi.,2020-09-16T13:49:22,private
101474,1476,Enim nemo eum deserunt nam tempora. Aperiam nostrum eaque explicabo dignissimos animi.,2020-02-10T09:54:34,private
101475,1141,Tempore cupiditate repellendus minima esse voluptates perferendis. Illo beatae debitis dignissimos.,2020-04-19T04:30:16,private
101476,1073,Recusandae ea quos maiores. Voluptatibus natus inventore doloremque a dolore saepe. Aspernatur ducimus consequatur veniam ex quae odit.,2020-04-16T17:52:33,followers
101477,1291,Interview daughter else. Go coach reflect. Speech reduce return near hospital.,2020-06-11T05:59:58,followers
101478,1180,Quaerat perferendis maiores. Iure natus alias suscipit vitae debitis quaerat blanditiis.,2020-02-03T19:12:26,private
101479,1439,Follow big nature than decade doctor. With each perhaps structure relationship knowledge. Security hot meeting huge loss.,2020-09-05T15:28:19,private
101480,1026,Iusto quo itaque quo. Autem id vitae at. Laudantium saepe vero sint fugiat.,2020-08-14T10:06:10,private
101481,1131,Recusandae ex quia a. Odit blanditiis consequuntur nihil quod.,2020-04-19T15:29:28,public
101482,1091,Woman heavy society a like among would. Evening former blood say hair decade ok environment. Themselves central activity magazine service region.,2020-07-19T07:08:54,followers
101483,1047,Ullam molestiae hic placeat et. Assumenda sunt dolorum nesciunt beatae.,2020-12-15T14:37:31,public
101484,1251,Role amount couple involve old memory. Option eye break always.,2020-04-15T09:27:14,followers
101485,1356,Ipsa in ipsam incidunt error molestiae molestiae. Molestias aperiam hic tempora iste laborum quod. Recusandae iure quibusdam iste illo molestiae vero. Earum nemo voluptatibus consectetur.,2020-09-28T18:20:49,followers
101486,1033,Adipisci cum hic culpa non in. Error explicabo dolorem reiciendis.,2020-08-16T05:36:51,followers
101487,1166,Quas eaque qui. Unde voluptas ex ullam labore commodi voluptatibus. Cumque atque commodi ea quas quisquam.,2020-12-05T16:46:38,followers
101488,1175,Do range record. Thought suddenly nothing lawyer include.,2020-11-22T17:19:06,private
101489,1025,Laudantium sapiente labore. Animi tempore itaque voluptate explicabo quas libero exercitationem.,2020-08-21T22:17:13,public
101490,1272,Eos nobis aliquid amet. Dicta commodi assumenda facilis. Odio possimus consectetur modi soluta amet odio vero.,2020-01-04T05:17:14,followers
101491,1036,Cupiditate quia expedita. Officiis iste voluptas iste deserunt similique.,2020-10-07T09:56:08,public
101492,1493,True learn think job tonight nothing country.,2020-08-20T05:41:47,private
101493,1153,Gas poor particular trial. Admit everything form.,2020-11-29T02:46:21,public
101494,1459,Tempore officia laudantium delectus tempora voluptatem pariatur. Non explicabo qui modi voluptatum facere accusamus.,2020-12-03T02:02:56,followers
101495,1066,At ipsum cupiditate repellendus aperiam adipisci perspiciatis cum. Amet impedit perspiciatis ratione eveniet laborum quisquam. Eaque mollitia corporis eaque sed.,2020-07-08T23:59:56,followers
101496,1097,Board we recognize six let minute. Peace cell real possible work door. Quite whole same ten my wrong.,2020-08-05T18:40:13,private
101497,1485,Doloribus possimus aut quae nam temporibus. Distinctio ut id. Praesentium eaque placeat quaerat.,2020-05-28T12:02:29,private
101498,1179,Eius impedit nobis ea tempore quae. Ut quas esse voluptate debitis magni neque voluptas. Ab doloremque repellat praesentium consequuntur beatae.,2020-03-29T01:51:53,public
101499,1004,Perferendis quo assumenda. Eum optio nihil quae. Ut adipisci earum assumenda a. Reiciendis eos mollitia fugiat.,2020-09-21T02:12:23,followers
101500,1186,Veniam impedit fugit quia iusto. Reprehenderit accusantium iste deserunt impedit iste ex expedita. Laborum illo dolor accusantium qui minus.,2020-02-24T11:30:01,private
101501,1174,Facere nesciunt beatae illum labore molestiae. Perspiciatis repudiandae quos reiciendis in et consequatur.,2020-02-05T09:50:42,public
101502,1076,Optio voluptas architecto. Perferendis dignissimos rerum. Debitis ipsa adipisci voluptatem.,2020-05-27T04:26:42,private
101503,1094,Assume final everyone body.,2020-08-04T06:26:27,public
101504,1415,Unde sunt fuga.,2020-04-05T14:35:08,followers
101505,1378,Present probably lay despite hope decide. Really all generation system.,2020-09-12T06:51:45,followers
101506,1497,Voluptatibus esse blanditiis fuga. Hic porro nam natus illo. Asperiores ullam soluta optio quo sapiente tenetur.,2020-06-16T08:15:32,private
101507,1157,Repudiandae aperiam sequi eius. Est occaecati ipsa nisi nostrum quasi culpa.,2020-08-13T12:16:54,followers
101508,1135,Autem unde ea asperiores. Praesentium aut iure ipsam. Ea quibusdam consequuntur debitis expedita.,2020-09-29T16:23:26,public
101509,1102,Commodi vitae harum cumque. Laborum laboriosam quas.,2020-11-06T09:34:14,private
101510,1371,Agreement suddenly nothing conference far. Base billion like good chance American.,2020-02-02T06:57:48,private
101511,1447,Quia provident sint qui. Totam dicta molestias dolore repudiandae. Adipisci voluptate eum quibusdam sint culpa.,2020-06-17T17:19:08,private
101512,1483,Quisquam distinctio voluptates animi iusto. Aspernatur iusto quia repudiandae nostrum.,2020-06-07T14:49:56,followers
101513,1091,Perferendis suscipit sunt iure labore perferendis dolore. Corporis soluta possimus libero a porro.,2020-04-30T10:36:52,followers
101514,1423,Beyond state their student. Threat sometimes view Congress position lose.,2020-11-21T17:26:56,public
101515,1087,Quam magnam quia neque consectetur quod cumque. Nisi quia ducimus qui.,2020-08-02T09:50:17,public
101516,1335,Iste corrupti natus numquam quas ipsum dolorum. Non consectetur officiis atque. Molestiae quaerat repellat expedita quibusdam eligendi.,2020-11-13T17:20:16,public
101517,1054,Tempore quidem dolores. Modi dolore corrupti perferendis quas. Iste vel distinctio incidunt ullam ducimus provident neque.,2020-01-06T12:25:57,private
101518,1194,Velit et eaque ut consequuntur ipsum atque. Ut quos nisi dicta minima. Iure accusamus suscipit modi quasi deleniti temporibus. Laudantium a cupiditate natus ex.,2020-11-09T17:06:43,public
101519,1087,Sequi vitae officiis placeat sunt. Quidem repellat ullam voluptatum aliquid quibusdam asperiores.,2020-12-24T19:49:58,private
101520,1039,Officiis dolor ab mollitia incidunt. Modi adipisci similique assumenda minus ut eum. Non veritatis reprehenderit est aliquam quam magnam.,2020-01-17T11:46:36,private
101521,1237,Ipsa molestiae illum nobis adipisci delectus laboriosam expedita. Fugit velit at reiciendis quo iure voluptatum temporibus.,2020-04-08T17:15:01,public
101522,1412,Not young special return dog after. Toward every pull rather present my.,2020-07-06T02:25:29,public
101523,1060,Necessitatibus provident dolorum. Doloremque quae tempora neque iusto consectetur harum. Excepturi accusantium architecto beatae ipsum quia.,2020-10-22T10:05:44,private
101524,1017,Lot air read store simply trial still.,2020-06-09T18:36:17,followers
101525,1259,Office argue these only. Story easy drug price military land. Ago rather miss star go morning service.,2020-07-17T01:48:45,private
101526,1497,Debitis sunt doloribus laudantium sed voluptates. Odit nemo libero repellat quam ad. Odio itaque ex quam error.,2020-11-30T16:13:45,followers
101527,1141,Labore deleniti fugiat aspernatur minima cupiditate dolorem.,2020-07-03T15:26:05,public
101528,1149,Doctor care plan when size. Business others view figure wonder suggest social. Model mention turn analysis with indicate physical help.,2020-12-11T17:47:46,private
101529,1425,Perferendis expedita officiis alias cumque aperiam neque porro. Quasi voluptate odio quasi rerum voluptatum.,2020-01-11T13:52:07,private
101530,1485,Eos porro harum incidunt. Repellat molestias eveniet debitis quo ipsum quasi.,2020-02-05T20:39:24,private
101531,1132,Est ea reiciendis nam praesentium autem. Accusamus quo eius veniam incidunt tenetur esse.,2020-12-30T23:05:44,followers
101532,1440,Effort could event involve call cell. Apply likely table soon institution. Drive bit before likely.,2020-08-27T21:12:46,private
101533,1140,Esse iusto repellendus autem. Placeat perspiciatis atque maxime quo minima possimus quod. Laborum alias perspiciatis est expedita.,2020-03-28T05:58:35,public
101534,1154,Excepturi earum rem quos nobis adipisci nemo rem. Magni a nobis voluptas cum doloremque. Sunt alias voluptatem ad perspiciatis facere temporibus.,2020-04-04T13:26:29,followers
101535,1317,Nesciunt consectetur reprehenderit aliquam. Tempora at odio minima omnis. Eum rerum maxime.,2020-06-26T19:51:29,public
101536,1419,Fund evidence whether my open. Town certainly yes and significant.,2020-12-15T00:22:38,private
101537,1245,Tempore est nihil. Voluptatum blanditiis consectetur quae ipsum. Soluta magni tenetur beatae.,2020-11-06T22:50:44,public
101538,1356,Consequatur consequatur eum cumque doloremque harum beatae. Amet odio et illo numquam nihil impedit aut. Sapiente porro quam laborum impedit harum temporibus. Vel quisquam dolore omnis nam sapiente ut.,2020-12-19T07:46:52,followers
101539,1338,Iusto eligendi consequuntur. Veniam modi vel fugiat.,2020-09-21T14:42:59,public
101540,1371,News particularly relationship not building whom including.,2020-03-28T08:08:25,private
101541,1256,Iste veniam dolorum atque minus. Repudiandae necessitatibus officia rerum voluptates beatae illum. A nostrum quod quod.,2020-04-17T05:28:25,public
101542,1212,Facilis doloribus error ad est quo. Quo recusandae impedit ea. Sed illum porro temporibus saepe eligendi.,2020-11-29T07:58:50,private
101543,1277,Accusamus nulla commodi magnam veritatis aliquam. Non vero ea blanditiis. Eaque recusandae harum aspernatur dicta.,2020-03-02T12:21:53,private
101544,1278,Nostrum minima repellat placeat autem minus totam. Cumque inventore at veritatis tenetur dolores. Commodi non expedita dolorem atque tempora eveniet eum.,2020-03-30T09:15:10,public
101545,1171,Impact case have back adult. Specific budget science white. Ever short style add star.,2020-05-22T06:42:16,followers
101546,1283,Garden day be explain later try up. Pressure fact medical gas herself key. Federal military fast. Term job man purpose town those begin.,2020-06-22T00:59:07,private
101547,1179,Aliquid consequuntur et ea cumque. Ab libero recusandae eligendi vitae deserunt. Repellendus ut facilis nemo.,2020-12-19T02:34:56,public
101548,1262,Animi in enim labore nisi. Iusto laboriosam non adipisci vero repellat voluptate.,2020-05-13T09:08:14,followers
101549,1145,Sure itself claim body same term experience. Simply area pass war.,2020-09-21T17:39:51,private
101550,1236,Deleniti tempore minus labore illo. Eius rem rem incidunt deserunt id. Est consequuntur nemo maxime.,2020-02-08T01:54:58,public
101551,1375,Pariatur maxime quia nulla minus expedita minus. Dolorem recusandae sit quas est. Sint accusamus voluptatem.,2020-12-05T02:06:59,followers
101552,1116,Voluptas animi harum dicta ullam. Commodi explicabo maiores nostrum ullam quia. Itaque sit optio amet numquam. Laudantium eius ex consequuntur atque voluptas voluptatem.,2020-09-01T06:50:42,followers
101553,1366,Quam corrupti vel at. Quis quod corrupti fugiat rerum non.,2020-10-17T05:58:20,followers
101554,1416,Numquam eum exercitationem molestiae itaque corrupti. Voluptates iste cum.,2020-02-02T11:05:41,private
101555,1007,Vero culpa quibusdam beatae. Id officiis minima.,2020-08-17T01:14:28,followers
101556,1224,Ea consequuntur facilis sint molestias. Nisi nesciunt nobis. Quaerat aut voluptatibus consequuntur consequuntur.,2020-11-15T14:26:25,private
101557,1481,Saepe beatae distinctio esse velit reprehenderit. Autem et quasi. Suscipit autem explicabo.,2020-09-18T22:17:35,followers
101558,1117,Quidem earum non quae incidunt. Eaque iusto neque ducimus enim ea. Sapiente nisi tempore. Reiciendis deserunt delectus illum esse.,2020-02-09T20:07:46,public
101559,1127,Optio corrupti necessitatibus necessitatibus. Molestiae in ipsa vero.,2020-04-21T07:51:23,public
101560,1446,Fugiat quidem earum saepe. Animi consectetur aut assumenda maiores delectus fuga. Quam tempora ipsa molestias corporis accusamus.,2020-02-17T14:15:53,private
101561,1491,Repudiandae doloribus corporis magni. Veritatis odio explicabo in molestiae error. Voluptas quidem at eius sapiente repellendus.,2020-04-26T23:44:12,followers
101562,1441,Eaque facere eveniet facilis dolores maiores sunt eligendi. Quis voluptatum et voluptatum veritatis illum dolor repellat.,2020-12-11T12:42:03,private
101563,1012,Ipsam officia aspernatur omnis. Eaque optio voluptatem quasi.,2020-02-06T21:29:06,followers
101564,1130,Consequuntur asperiores dolorum aut. Porro non maiores expedita.,2020-06-02T11:02:22,followers
101565,1061,Pay similar response though nothing. Near age sport remember manage traditional.,2020-10-26T06:42:25,followers
101566,1377,Nihil incidunt animi consequuntur. Repudiandae voluptate in totam. Quasi libero illo voluptas ea dolor id.,2020-04-29T22:41:43,private
101567,1203,Doloribus porro aliquam voluptates molestias mollitia beatae.,2020-05-03T17:20:01,followers
101568,1224,Natus sunt esse. Ipsa consectetur aperiam vitae adipisci. Quasi soluta modi at sapiente dolores suscipit in. Aspernatur asperiores quisquam provident cum ad.,2020-02-09T04:35:13,public
101569,1241,Beatae repudiandae unde labore repellat in expedita necessitatibus.,2020-07-02T10:36:52,followers
101570,1368,Ab dolor ipsa animi exercitationem placeat quis. Libero necessitatibus iure recusandae.,2020-04-03T18:50:52,private
101571,1179,Libero sunt consequatur excepturi esse. Nesciunt repellat repellat repellendus id laborum sed.,2020-10-04T21:02:04,private
101572,1218,Product notice moment career force hair. Also watch animal five. Campaign important toward.,2020-10-19T22:49:07,followers
101573,1328,In soluta cupiditate harum autem. Ipsa aspernatur atque libero. Nemo perspiciatis est numquam cum hic tempora.,2020-05-04T18:53:35,followers
101574,1328,Forget newspaper relationship. Manage weight everyone evening news cover window. Stop be until alone space himself.,2020-04-07T07:54:48,public
101575,1324,Wind small order success project imagine alone report. Network term data concern pressure learn opportunity. Clear two conference to. Amount one happen lead edge arrive deep.,2020-12-18T06:28:16,private
101576,1413,Beatae perspiciatis consectetur vitae ullam tempora sequi. Enim doloremque repellat dolores distinctio. Nesciunt dicta ullam itaque debitis.,2020-04-30T19:13:18,private
101577,1152,Nemo maxime magni voluptatibus sunt expedita necessitatibus. Repudiandae dolore numquam. Aliquam architecto recusandae ratione.,2020-04-15T18:59:02,private
101578,1032,Occaecati provident reprehenderit adipisci alias doloremque libero. Tenetur inventore excepturi fugit sapiente. Pariatur in mollitia sint amet exercitationem ipsa.,2020-11-01T12:12:13,public
101579,1488,Nostrum repellendus architecto laudantium cumque explicabo officia. Nihil reiciendis delectus. Molestias rerum consequatur aliquid.,2020-01-22T15:12:25,private
101580,1132,Ad ipsa blanditiis quaerat esse facilis eum. Ea autem cupiditate. Corporis doloribus natus quidem.,2020-05-29T21:32:13,followers
101581,1389,Aspernatur fugiat ad. Magni commodi corrupti corporis repellendus sint eos deserunt.,2020-12-04T17:16:03,public
101582,1304,Error veniam ab ea nesciunt magnam. Repudiandae pariatur ullam eligendi eius incidunt labore.,2020-07-29T01:33:01,private
101583,1009,Recusandae veniam qui ipsum molestiae et facere. Quos quisquam similique unde quibusdam excepturi exercitationem. Doloremque ratione inventore quibusdam eveniet unde.,2020-01-10T09:47:43,followers
101584,1488,Small magazine only because. Wait cut husband most.,2020-10-04T19:49:47,private
101585,1321,Road listen whether test answer trip film. Small table compare most.,2020-01-21T18:35:58,private
101586,1086,Optio animi inventore recusandae. Molestias voluptates magni maxime ab tenetur voluptatibus. Voluptatum ex sint molestiae facilis officia eum.,2020-02-01T19:32:17,followers
101587,1100,Analysis senior wide first. Arrive role name growth investment rule give as.,2020-05-02T01:34:55,private
101588,1044,Et dicta tempore possimus modi quia animi eos. Neque asperiores molestias ipsum corrupti unde officiis. Repellat illum quo architecto natus quasi quae. Cupiditate nam eum nam magni.,2020-08-05T20:37:17,followers
101589,1455,Mother too pass enough still compare. Reduce artist do care light process figure.,2020-06-26T21:46:24,followers
101590,1237,Vero iste impedit amet. Deserunt velit dolorem voluptate nemo natus sunt.,2020-10-30T13:28:50,followers
101591,1018,View reality million major capital add western. Experience many girl through manager.,2020-02-24T05:12:38,followers
101592,1133,Some speak experience. With old list heavy. Draw left available must against state eat.,2020-12-06T08:36:19,private
101593,1461,Illo aliquam velit. Impedit praesentium doloribus itaque natus. Dicta nulla magnam dolores nisi.,2020-11-18T09:47:32,followers
101594,1079,Explicabo nostrum pariatur autem. Quia minus quod cupiditate.,2020-07-03T04:49:19,followers
101595,1323,Inventore porro aut dignissimos hic facere. In voluptatibus nesciunt dolorum.,2020-12-11T06:18:00,public
101596,1095,Libero iste inventore ut porro cumque. Eligendi corporis ab deleniti nulla minus. Unde eligendi vero rerum iusto alias.,2020-08-24T11:05:42,followers
101597,1438,More than painting loss contain cause. Shoulder hundred possible. Spend gun city trial strategy offer forget drive.,2020-02-04T00:05:59,private
101598,1284,Ipsum vitae reiciendis ab minima voluptates recusandae consectetur. Ipsum iusto animi dicta incidunt praesentium vitae.,2020-04-25T04:59:43,public
101599,1068,Trade admit tend black answer. Reason behind decision pay interest become risk think.,2020-09-26T23:42:55,followers
101600,1465,Hotel himself letter billion. Alone anyone each firm section same hard.,2020-07-12T21:53:44,public
101601,1388,Iste vel tempore inventore. Architecto dolores porro at corporis.,2020-12-03T18:48:44,private
101602,1199,Cupiditate fuga commodi. Voluptas omnis magni aliquid.,2020-06-25T19:51:20,private
101603,1224,Eveniet quam ipsam error nam sapiente qui voluptas. Maiores mollitia molestiae animi architecto laborum recusandae. Deserunt fugiat eum error dolore suscipit. Distinctio quisquam officia qui ut deleniti.,2020-01-14T10:47:02,private
101604,1413,Manage few man food tax describe focus choice. Right simply behavior loss poor ground air agency. Girl table that member.,2020-05-07T17:11:37,private
101605,1254,Vero dignissimos repellendus vitae quae occaecati eligendi. Et neque fugiat aliquid unde assumenda laborum.,2020-10-11T11:25:43,private
101606,1322,Would including ball soldier myself bed suffer purpose.,2020-12-14T07:46:32,public
101607,1418,Boy else medical behavior surface Mr. Available wait bring how vote. Same think concern perform simply model week.,2020-11-23T12:42:27,followers
101608,1058,Porro officia necessitatibus quis in aut quae. Laudantium optio quidem quaerat repellendus distinctio ipsam. Quasi eligendi minima dolores repudiandae nisi.,2020-02-13T06:29:30,private
101609,1499,Molestiae vero fuga ducimus id. Incidunt repudiandae esse error quaerat molestiae.,2020-12-06T19:20:20,public
101610,1271,Eveniet molestias velit culpa. Nostrum dolor recusandae repudiandae dicta.,2020-10-08T13:25:28,followers
101611,1236,Distinctio non ab fugiat. Laborum fuga facilis perferendis quae magnam a.,2020-08-12T11:48:14,private
101612,1188,Seek traditional tell truth seven. Start site only each doctor pull break final. While one note bed reflect most apply bed.,2020-05-26T17:04:56,followers
101613,1112,Numquam corporis amet nisi molestias. Expedita sunt voluptatum adipisci officiis sapiente impedit.,2020-05-29T14:36:34,followers
101614,1335,Delectus temporibus totam sint fugiat alias voluptate. Eveniet possimus in.,2020-10-17T20:54:26,public
101615,1295,Sunt odit et enim ducimus. Quaerat nesciunt itaque neque. Magni neque atque eius repellendus nisi. Exercitationem ipsum atque repudiandae maxime ipsum suscipit.,2020-07-13T09:06:12,followers
101616,1364,Facilis perspiciatis incidunt nihil voluptatibus amet debitis odit. Eligendi tenetur molestiae occaecati deleniti cupiditate amet laboriosam.,2020-12-15T14:21:11,followers
101617,1381,Nostrum nisi fugiat nihil. Odio ipsum delectus placeat sit. Suscipit fugit quia debitis iste tempore. Laudantium dolorem provident labore itaque quaerat.,2020-04-01T02:29:10,public
101618,1418,Case particularly any lawyer thought yes.,2020-12-20T03:47:48,public
101619,1227,Occaecati laborum modi non libero odit eveniet. Labore laborum soluta ab. Voluptates rem commodi hic.,2020-12-26T03:05:01,private
