post_id,user_id,body,created_ts,visibility
100000,1193,Respond security especially peace since. Keep record rock way serious wear six.,2020-08-26T18:11:53,followers
100001,1373,Esse provident at animi aspernatur molestiae ut. Reprehenderit at quibusdam nisi omnis nihil. Laudantium quia architecto occaecati unde illo est.,2020-12-11T21:44:48,private
100002,1476,Girl wife near participant. Dinner college who contain them half. Game reason artist office decade hotel three.,2020-03-18T13:58:41,public
100003,1357,List concern mother election weight page. Peace significant sign heavy general record. Partner special pressure plan line.,2020-12-16T23:51:57,followers
100004,1051,Adipisci nobis ducimus quo blanditiis totam in. Quod quo atque fugit labore.,2020-11-12T11:52:44,public
100005,1213,Libero amet fuga cupiditate suscipit ab.,2020-10-30T07:40:32,private
100006,1354,Voluptas maiores velit temporibus amet dolorem. Minima accusamus ullam praesentium itaque. Saepe illum ipsum sed eaque.,2020-07-27T23:49:13,public
100007,1018,Realize cost each various this speech first. Particularly maintain popular cup state team instead.,2020-06-13T15:21:54,public
100008,1324,Plan drug better bank throw matter. Notice wrong myself.,2020-02-02T19:06:17,public
100009,1350,Commodi repudiandae itaque quisquam iusto omnis. Porro laudantium provident beatae temporibus ipsam ullam. Dolore non tempore at exercitationem quasi adipisci.,2020-05-12T22:20:40,private
100010,1010,Iusto corporis aliquid suscipit similique. Facilis esse excepturi ipsum fuga esse. Ex placeat quidem quidem asperiores.,2020-03-30T22:46:12,private
100011,1425,Omnis esse esse ullam dignissimos cum. Tenetur ipsam debitis ea. Incidunt ab voluptates distinctio.,2020-08-21T11:34:09,public
100012,1267,Architecto dolor delectus est dicta. Fugiat quis aliquid reiciendis.,2020-10-30T20:12:56,public
100013,1146,Deserunt animi aperiam nobis recusandae dolores autem. Repellat modi aliquid minus excepturi quam nobis. Dolorum consectetur totam quos laudantium deleniti odit.,2020-02-25T07:33:59,public
100014,1114,Officiis et dolores vitae repudiandae maiores. Enim vero temporibus ipsam aut a. Quae et ullam assumenda consectetur quas.,2020-04-21T10:37:03,public
100015,1290,Ipsam numquam recusandae odio. Hic cum deleniti quis quia adipisci dolorum.,2020-01-07T08:04:57,private
100016,1084,Commodi quos ipsa expedita a. Dignissimos facere distinctio labore. Repudiandae fugit soluta repellendus possimus.,2020-06-09T19:32:18,followers
100017,1325,Quibusdam nemo expedita deserunt neque deleniti quaerat. Quis possimus ipsum eum iure aspernatur iste.,2020-04-21T11:56:07,private
100018,1035,Velit neque vitae eum nemo facere repellendus. Voluptas dolorum illo quasi. Sequi neque dignissimos vero.,2020-01-25T11:15:04,public
100019,1194,Dolorum fugiat nihil assumenda cum atque et. Iure delectus dolore. Nostrum aperiam tenetur eligendi quia quidem labore odio.,2020-09-14T08:43:03,public
100020,1266,Reality house card year really such. Mr drive education high current financial ahead. Lawyer project recent minute weight prevent. Instead factor information speech ever.,2020-02-10T14:42:48,private
100021,1050,Id eum laborum impedit. Eum sint velit at dignissimos.,2020-04-28T11:25:03,public
100022,1403,Veniam ipsam doloribus ex deserunt delectus. Porro corporis ullam perferendis. Dolore laboriosam harum unde pariatur.,2020-08-24T23:36:56,followers
100023,1134,Facilis eius pariatur deleniti delectus.,2020-01-27T21:56:44,private
100024,1430,Street skill wife policy from probably occur. Go trade produce movie.,2020-12-06T04:55:03,private
100025,1494,Alias autem dolor veritatis. Beatae cumque similique sequi perferendis enim. Ipsum aut error doloremque atque error. Culpa accusamus minus veniam modi nihil distinctio.,2020-10-20T00:26:38,private
100026,1007,Fugit facere ad officiis. Cum molestias pariatur mollitia in iste recusandae. Itaque cupiditate tenetur iste.,2020-12-23T21:48:00,followers
100027,1160,Maxime officiis cupiditate distinctio sapiente hic. Amet explicabo deserunt fuga molestias dolorum qui. Reprehenderit et illum totam tenetur rerum.,2020-03-30T16:03:02,private
100028,1425,Ex natus molestias molestias quos mollitia. Possimus odit officia. Autem expedita provident provident odit ducimus voluptatum.,2020-05-13T23:14:16,private
100029,1328,Dicta ratione omnis cupiditate. Repellendus ullam necessitatibus dolores eaque eos.,2020-09-16T11:17:41,followers
100030,1239,Dolore dolores nemo deserunt aperiam odit velit. Accusamus eveniet id aut natus. Laudantium quae dolorem repellat provident.,2020-11-08T16:25:16,private
100031,1292,Debitis maxime tempore voluptatum qui repellat omnis repellat.,2020-09-21T20:42:37,followers
100032,1153,Voluptas saepe magni deleniti nobis placeat. Qui sed eveniet recusandae. Quam officia quos officia illo quia voluptatibus dolorem.,2020-11-30T14:30:11,public
100033,1450,Saepe architecto quo exercitationem in.,2020-03-09T21:59:20,private
100034,1228,Molestiae sed sint laudantium. Nisi temporibus cupiditate dolorem.,2020-09-15T15:32:48,private
100035,1461,Lawyer another suddenly realize yard. According thus wear serious piece.,2020-01-03T10:50:27,public
100036,1413,Blanditiis odit soluta voluptas sunt. Aliquam error odio repudiandae quam nam.,2020-01-28T03:35:53,private
100037,1364,Veniam velit ad officia. Qui dolor cumque at sit.,2020-01-31T10:14:07,public
100038,1026,Nihil sapiente est commodi.,2020-01-10T07:33:40,public
100039,1495,Architecto laboriosam nulla ratione eius. Quam sapiente tempora blanditiis id quibusdam. Dolorem ea reiciendis beatae debitis sint.,2020-11-06T13:59:52,followers
100040,1081,Consequatur aut maxime officiis. Ipsum necessitatibus earum voluptatibus modi quis nostrum.,2020-04-19T09:03:11,followers
100041,1094,Black cup month inside all by hair. Sea our from how body.,2020-04-01T03:40:23,followers
100042,1119,Repudiandae exercitationem asperiores distinctio labore nisi. Doloremque praesentium assumenda odio.,2020-07-25T15:46:58,followers
100043,1279,Doloribus necessitatibus odit. Ut quia illo voluptas recusandae labore alias odio.,2020-03-04T16:26:02,followers
100044,1309,Indeed me just happy up or morning. Music boy high our moment society.,2020-10-25T18:59:07,public
100045,1298,Aspernatur ullam vel quae ipsa dignissimos quam. Fuga illo voluptas asperiores.,2020-03-13T09:14:38,private
100046,1007,Nam saepe cum molestias. Fuga aliquid nisi voluptate.,2020-12-03T03:11:18,followers
100047,1355,Earum deleniti reiciendis reiciendis. Repellat voluptatibus aperiam at nihil exercitationem. Libero ipsum illum occaecati officiis explicabo quaerat. Architecto aliquam laboriosam modi quas error inventore.,2020-04-29T22:21:01,public
100048,1321,Aperiam quisquam laudantium quasi doloremque. Maiores earum hic sint accusantium tempore minus perspiciatis. Dolorum fuga accusamus nulla ad at.,2020-07-03T15:07:21,public
100049,1131,Tempora adipisci repellendus optio.,2020-03-20T02:00:42,followers
100050,1343,Similique in maxime sapiente.,2020-12-01T17:09:25,private
100051,1477,Ducimus consectetur ipsa nisi non provident iusto. Dolor expedita molestias.,2020-06-27T01:06:26,followers
100052,1138,Neque sunt beatae ea corrupti. Magnam laborum recusandae ratione voluptatum ea laboriosam.,2020-02-02T08:04:44,public
100053,1173,Aliquid quibusdam ipsa modi labore excepturi. Libero dolorum assumenda labore doloremque.,2020-12-01T18:26:38,private
100054,1406,Perspiciatis accusamus doloremque temporibus. Architecto atque possimus ut animi dolorem velit.,2020-01-26T14:22:09,public
100055,1311,Quam autem nisi adipisci. Beatae cum cum excepturi. Hic quam placeat nam.,2020-07-15T12:49:42,followers
100056,1347,Atque commodi consequuntur quaerat quis. Earum sed quasi itaque. Error facere quisquam facilis deserunt labore fugit.,2020-11-12T23:10:33,followers
100057,1333,Hair serious turn lawyer ground apply story. Animal power worry adult police. Spring long cut bad medical send with myself.,2020-02-10T04:04:12,public
100058,1350,Quis cumque sit totam quidem incidunt sunt.,2020-04-05T11:43:54,private
100059,1120,Error impedit quia temporibus. Occaecati ab sapiente corporis ipsum. Voluptatem dicta amet vero ipsa.,2020-07-12T07:04:32,private
100060,1014,Neque vero est ipsam eos aliquam. Quas voluptate ratione.,2020-01-14T14:51:01,public
100061,1447,Join beyond everything manager. Know course be.,2020-11-13T21:14:51,private
100062,1430,Amet eius soluta deleniti assumenda. Modi nam aliquid consequatur dignissimos eius labore exercitationem. Reiciendis dolores modi similique ipsam nisi culpa.,2020-08-03T22:44:36,public
100063,1315,Perspiciatis aliquid vitae a iure itaque. Doloremque facere blanditiis veniam ducimus illum illo.,2020-01-15T15:15:30,followers
100064,1005,Cupiditate minima doloribus eum debitis rerum. Ad odio voluptas rerum dolorum dolor vero. Neque consequatur accusantium ducimus quos reiciendis.,2020-05-02T11:16:59,followers
100065,1483,Soluta eos ipsum numquam at omnis. Rerum officia explicabo deserunt. Blanditiis omnis commodi dolorem nostrum provident mollitia. Laboriosam dolorum odit facere esse saepe.,2020-03-08T18:33:42,private
100066,1361,Court statement step next set must admit test. Decade offer decade and husband enjoy. Support their instead two. Vote opportunity plan huge.,2020-08-06T14:06:54,public
100067,1236,Quaerat quaerat nostrum itaque natus. Hic iusto rerum nam in qui. Laboriosam quae odio porro.,2020-09-25T12:07:30,private
100068,1158,Impedit rem suscipit ex quam minima. Dolor nemo nostrum dolorem beatae impedit ratione consectetur.,2020-01-08T18:31:44,public
100069,1312,Saepe dignissimos ratione ratione autem autem minima. Unde sapiente modi laborum ipsum delectus.,2020-12-15T01:10:41,followers
100070,1294,Tempore alias nostrum quaerat modi unde distinctio. Nulla dolorem ut voluptate.,2020-09-03T23:34:37,public
100071,1165,Pariatur culpa nihil repellat officia esse ad. Quidem architecto voluptatem error.,2020-02-15T08:46:17,followers
100072,1026,Recusandae cupiditate dolores. Ipsum cumque quas adipisci hic vitae soluta est.,2020-02-11T12:08:15,followers
100073,1238,Dolores incidunt soluta optio. Optio vel eveniet optio impedit qui.,2020-12-19T11:12:28,followers
100074,1170,Quis reiciendis laudantium enim voluptatibus quos occaecati. Dolorem expedita cum ipsa.,2020-10-07T15:59:33,public
100075,1254,Distinctio deserunt est rerum magnam aut eligendi. Voluptas sequi corrupti laudantium porro error. Velit itaque suscipit eveniet quisquam fugiat cupiditate.,2020-04-29T20:55:35,followers
100076,1412,Illum id et beatae atque quo sed. Eius ea voluptates voluptas temporibus similique et. Quis corporis vero ipsa. Autem unde consequatur cumque labore rem et.,2020-04-21T04:10:25,followers
100077,1252,Cupiditate delectus cupiditate fugit. Accusantium natus pariatur quas mollitia distinctio numquam.,2020-09-13T17:57:17,public
100078,1169,Effort almost statement tough. Young environment face any though. Material center late left skin college.,2020-12-10T23:15:51,followers
100079,1088,Soluta dignissimos voluptas tenetur. Autem corporis eligendi accusamus quae.,2020-11-23T02:55:08,followers
100080,1234,Ea dolores voluptates mollitia quas repellat. Magni odit assumenda unde ex provident enim.,2020-07-19T06:57:11,private
100081,1215,Recusandae esse dignissimos commodi magni earum voluptatum. Alias cumque distinctio soluta. Vel doloribus nisi in hic.,2020-07-21T00:56:30,private
100082,1326,Tenetur labore corporis perspiciatis qui repellat deleniti.,2020-08-11T18:23:34,followers
100083,1177,Possimus unde sapiente ut cumque deserunt. Officia nulla et distinctio quam quas eaque.,2020-10-26T13:53:03,private
100084,1427,Facere odio tenetur alias. Molestiae voluptatum blanditiis ex.,2020-11-28T01:05:44,public
100085,1442,Rem expedita inventore hic nobis deleniti labore. Atque et accusantium placeat debitis at.,2020-02-09T19:46:28,private
100086,1398,Officiis maxime enim eaque. Delectus nam fuga sapiente vitae nemo expedita.,2020-02-17T05:31:10,public
100087,1186,Whom for experience. Vote western manager line kind network focus. Real really skill forward myself face instead.,2020-05-22T15:42:22,followers
100088,1094,Accusamus facilis repudiandae repudiandae sunt. Facilis fuga reprehenderit sunt aperiam maxime incidunt iusto. Rem voluptatem ipsa repellat a recusandae.,2020-05-16T05:20:24,private
100089,1285,Pariatur dignissimos omnis fuga. Ad fuga eum quas doloribus culpa. Nesciunt consectetur alias.,2020-03-20T06:09:50,private
100090,1096,Ex quasi ipsa minima doloremque. Fugiat debitis quibusdam consectetur saepe.,2020-07-16T08:44:17,public
100091,1134,Perferendis odit rem enim nihil delectus.,2020-06-12T19:46:01,followers
100092,1324,Vero eos ea laudantium officiis magnam.,2020-01-27T13:07:01,private
100093,1366,Delectus expedita soluta quis provident consectetur. Dolorum quidem quas iure iure iure.,2020-06-26T07:24:05,public
100094,1186,Architecto repellendus quidem nemo. Quaerat enim fuga quidem at dignissimos.,2020-06-09T16:42:31,public
100095,1066,Nemo in velit officiis doloremque cupiditate sunt. Molestiae veritatis quas esse quisquam corrupti expedita veritatis.,2020-01-20T00:29:41,public
100096,1093,Ad explicabo qui nobis fugit pariatur unde. Autem ullam nobis iste quaerat.,2020-11-30T13:47:40,public
100097,1416,Aliquam ratione facilis. Animi consequuntur temporibus odio quasi. Excepturi quod ullam temporibus debitis corporis. Quod assumenda nostrum sapiente sapiente doloribus.,2020-05-03T01:45:45,private
100098,1204,Attack moment candidate. Shoulder eat threat training simply industry president. Explain ago church.,2020-06-29T12:48:50,public
100099,1086,Laudantium a vero reiciendis officia excepturi consequatur iusto. Omnis perferendis quidem maxime delectus nobis. Esse nulla tenetur velit distinctio velit nemo.,2020-05-21T19:29:30,public
100100,1440,Iusto ad quos repudiandae. Quae aut itaque totam iure consequuntur aliquid. Incidunt ad ratione eum.,2020-01-31T17:20:33,private
100101,1461,Optio nemo quos repellat ipsum. Minus fugit cupiditate voluptatem perferendis accusantium. Quos tempore nihil placeat nulla iusto.,2020-12-19T20:28:38,public
100102,1050,Ad laboriosam soluta perferendis ullam dolor a quibusdam. Libero ea sapiente perferendis consequatur quas nobis cum. Sed dicta consequatur soluta non.,2020-11-11T06:40:40,private
100103,1131,Eligendi fuga architecto eos quos. Rem fugit eos vitae nostrum.,2020-10-01T02:11:06,private
100104,1075,Past try force best help. Agency opportunity write because.,2020-02-06T09:17:53,followers
100105,1491,Voluptatibus corporis quam ab aliquam qui iste dolorum. Dolore mollitia distinctio commodi blanditiis. Animi ex nihil molestiae quasi cum natus.,2020-02-04T11:46:02,public
100106,1480,Voluptatibus eum alias sapiente. Facere quam quisquam officia amet doloremque. Sequi eius nam nesciunt in exercitationem.,2020-12-19T17:59:23,public
100107,1410,Cup American serve walk energy. Create else arrive character result. Plant boy end ten word.,2020-10-20T21:58:32,followers
100108,1030,Exercitationem ex laborum quidem fuga. Esse recusandae delectus iure hic. Minima asperiores adipisci voluptatum temporibus.,2020-01-30T18:17:42,public
100109,1154,Est consectetur provident recusandae porro consequuntur rem. Minus iusto laudantium neque dolore. Tenetur natus ea deserunt.,2020-10-09T10:02:54,public
100110,1383,Need responsibility cultural follow. Unit while speak. Suffer trial character than food affect difference.,2020-03-05T00:33:13,private
100111,1405,Odit provident esse vero laborum aspernatur voluptatibus provident. Dicta reprehenderit deleniti commodi consequuntur exercitationem. Quas earum adipisci veniam dicta.,2020-11-21T17:28:33,private
100112,1071,Repudiandae deleniti porro quis eaque incidunt error dolor. Natus quos quod dolorum. Ducimus at excepturi quidem reprehenderit vitae recusandae.,2020-08-05T07:29:48,private
100113,1487,Sequi tenetur doloribus repellendus id ullam provident. Autem corporis quasi dolore.,2020-01-08T04:58:51,private
100114,1113,Dignissimos expedita maiores reiciendis. Ad tempore quae illum ex omnis dolor non.,2020-07-11T23:33:25,public
100115,1328,Libero minima accusamus optio doloremque. Inventore maxime placeat voluptates minima mollitia.,2020-02-09T18:48:02,followers
100116,1124,Aperiam reiciendis rem occaecati sapiente ducimus dolor. Minima voluptatum aliquid veritatis itaque quibusdam.,2020-06-07T05:50:58,private
100117,1280,Deleniti sunt sapiente itaque dignissimos sed assumenda. Alias officia ratione dolores quas cumque. Deserunt aperiam recusandae deserunt earum excepturi dolorum quasi.,2020-10-03T19:24:48,public
100118,1003,Impedit eum quibusdam molestiae. Facilis laboriosam facilis.,2020-07-23T14:23:22,followers
100119,1058,Et fugit eveniet esse corrupti voluptatum. Ipsa nisi maiores quod nisi iusto aspernatur voluptate. Ipsa unde voluptate ab ullam minus tempora. Ab quibusdam asperiores occaecati deserunt totam.,2020-11-09T10:06:50,private
100120,1455,Corporis magnam sed quisquam. In fugit tempore omnis harum.,2020-04-22T03:35:16,public
100121,1012,Perhaps job pull and officer. The in popular deep need choice.,2020-09-19T02:47:17,followers
100122,1231,Similar author official deep never program religious four. Fill rise those inside daughter buy dream. Few throughout yes young age benefit international anything.,2020-10-08T20:56:31,private
100123,1332,Doloribus quia expedita accusantium esse a excepturi dolores. Esse pariatur id. Quos veniam sit quis sed.,2020-05-26T11:32:16,followers
100124,1229,Laborum totam similique laudantium libero voluptatibus velit soluta. At exercitationem tenetur sit.,2020-10-31T01:50:44,followers
100125,1323,Play sing always real foreign. Factor fly design character sister. Positive easy green health.,2020-02-16T02:56:53,public
100126,1072,Fugiat facere aspernatur similique occaecati dolores molestias tenetur. Eaque perspiciatis veniam. Recusandae dolorem error quibusdam quasi eaque magni.,2020-11-10T03:01:55,followers
100127,1171,Blanditiis ducimus pariatur ab culpa suscipit sequi facilis. Dolores nostrum id adipisci. Tempora fugiat inventore itaque exercitationem.,2020-08-05T13:05:01,public
100128,1413,Incidunt soluta vitae. Reiciendis animi tempora dignissimos nam fugiat eius.,2020-06-08T11:53:27,followers
100129,1444,Quas mollitia quis qui asperiores ipsum quam.,2020-02-06T17:16:37,public
100130,1400,Velit dolorum in minus velit reiciendis. Fuga in dolore velit facere.,2020-06-05T21:19:45,public
100131,1187,Ex corrupti numquam laborum consectetur. Animi aut quas beatae mollitia repudiandae architecto amet.,2020-09-01T23:57:16,private
100132,1158,Reprehenderit quidem ex eaque eaque qui. Modi explicabo consequatur dolores officiis possimus.,2020-03-10T19:32:01,private
100133,1436,Camera sister sense firm trouble. Meeting certain knowledge little. Collection area space green parent then term.,2020-12-17T14:12:28,followers
100134,1441,Eligendi earum inventore esse. Non laborum sunt itaque assumenda at.,2020-06-01T23:05:57,private
100135,1465,Nisi dolorem ab eligendi dolorem vitae maxime. Eveniet ea assumenda rem.,2020-02-21T19:37:09,followers
100136,1467,Aspernatur ea quibusdam qui. Unde blanditiis dolorum alias modi deleniti. Deleniti placeat et exercitationem odio.,2020-02-23T10:26:12,followers
100137,1368,Cum esse ipsum voluptas maxime ab blanditiis. Illo consectetur minus amet ratione. Nobis iure alias perferendis doloribus facilis.,2020-12-24T13:21:09,private
100138,1374,Provident modi neque libero placeat similique adipisci. Unde quisquam expedita corrupti saepe cumque ipsa. Aspernatur mollitia laboriosam delectus.,2020-10-09T07:55:50,private
100139,1217,Voluptates incidunt molestiae aperiam deleniti fugit ex. Earum excepturi est optio deleniti consequuntur. Tempora laboriosam ad cumque impedit voluptate.,2020-10-22T01:04:17,public
100140,1311,Repellendus itaque eligendi at. Quia optio aliquam minus molestias amet earum.,2020-08-07T13:38:41,public
100141,1136,Aliquam maiores laudantium est soluta rerum. Magnam omnis fugiat doloremque reiciendis.,2020-11-20T09:51:01,followers
100142,1067,At eaque mollitia facere itaque sapiente cumque. Totam autem ab.,2020-06-14T04:20:58,public
100143,1334,Democratic country guy drop past either. Arm information society simply. Account never college thought food if discover.,2020-01-28T13:23:41,public
100144,1307,Ducimus magni mollitia saepe assumenda tempore. Quos atque minima culpa nulla omnis autem aperiam. Alias officiis eaque natus. Commodi nisi in voluptate nobis ipsa nisi soluta.,2020-09-03T18:53:34,public
100145,1197,End much cost loss send raise character. Help quality still cut evidence bill.,2020-04-18T05:54:36,followers
100146,1095,Deserunt numquam itaque quasi saepe doloribus voluptas.,2020-12-29T00:36:50,public
100147,1268,Knowledge trial outside test shoulder however. Loss raise make maybe toward issue ago thus. Have other either point writer. Sense early several per information hundred.,2020-06-21T11:35:36,public
100148,1219,Doloribus pariatur veniam quod corporis.,2020-03-25T23:44:26,public
100149,1051,Illo necessitatibus numquam accusamus. Harum impedit iure. Repellendus pariatur dolor sequi. Magnam tempore pariatur maiores odio perferendis dignissimos excepturi.,2020-01-08T21:33:27,public
100150,1020,Vel deleniti error ea. Maiores porro dicta vero dolorum ex placeat.,2020-07-13T04:12:37,private
100151,1343,Possimus nostrum in maxime est earum expedita. Nemo inventore voluptates.,2020-02-10T10:59:05,private
100152,1039,Accept sing others teacher direction as statement. Station nice my sign set defense interest. Establish as wrong factor.,2020-04-15T07:15:03,public
100153,1135,Velit cupiditate dolores est sed in exercitationem asperiores. Occaecati blanditiis adipisci.,2020-06-19T14:30:42,followers
100154,1422,Occaecati ab sit tempore. Iure est suscipit aliquid dolores non. Ut quia nisi illo. Rerum deserunt ab sunt corporis deleniti voluptate.,2020-12-04T08:17:10,followers
100155,1222,Dolorem nulla dignissimos nemo praesentium nisi. Dignissimos molestias quis eum tenetur officiis id. Illo placeat accusantium laborum amet quod qui.,2020-02-27T03:15:49,followers
100156,1271,Officia blanditiis minima qui laborum provident. Excepturi repellat molestiae minima ea fuga. Totam pariatur quisquam neque fuga.,2020-10-06T04:48:28,private
100157,1130,Quaerat excepturi fugit sit. Adipisci consequuntur magnam sit atque provident optio. Fugit laboriosam quas distinctio. Totam ab error.,2020-01-07T10:34:46,public
100158,1463,Suscipit eius similique vel. Id perferendis quod odio sed id repudiandae dolorem. Aspernatur cum molestiae at.,2020-04-02T15:54:42,followers
100159,1401,Odit rem nihil dicta. Nemo maiores amet saepe asperiores aut aut. Quos quidem voluptas ipsa hic dicta.,2020-04-12T05:08:07,public
100160,1077,Ad a hic incidunt harum vero. Expedita harum odit numquam quibusdam illum sint. Veritatis voluptas aliquam quos. Laudantium perferendis harum error vero.,2020-03-22T11:46:26,public
100161,1499,Libero quas iste error quos corrupti. Placeat vel explicabo odio temporibus alias in. Sint officiis eveniet aperiam iusto a facere.,2020-05-13T04:29:34,public
100162,1427,Impedit cupiditate deserunt voluptatibus quam ea dolor. Facilis debitis mollitia adipisci natus sunt sapiente.,2020-05-30T18:54:22,followers
100163,1209,Ipsam soluta quae atque hic quo.,2020-10-01T18:51:40,private
100164,1407,Voluptatum facilis aperiam hic ex ipsa. Cupiditate reiciendis nihil ipsum facilis. Illo deleniti quas fugiat beatae dolor placeat.,2020-07-22T17:19:19,private
100165,1220,Optio corrupti doloribus perferendis ullam eum. Error distinctio sint iure facilis ipsum adipisci sit.,2020-10-21T17:34:27,public
100166,1375,Recognize public seem. Green source heart need surface enough rise.,2020-09-19T12:54:10,public
100167,1061,Earum aspernatur aut assumenda porro. Libero laborum earum odio. Ad distinctio quia animi distinctio vitae possimus.,2020-03-09T10:30:57,public
100168,1284,Esse vero veniam eligendi quasi nulla culpa. Harum repellendus quisquam excepturi hic doloribus. Enim tenetur illo saepe laborum ipsa cumque.,2020-11-26T08:43:27,followers
100169,1333,Ex officiis nemo dicta sunt aut quasi. Voluptate voluptatem occaecati nobis voluptas totam. Beatae doloremque expedita excepturi.,2020-10-30T13:00:20,public
100170,1364,Reality establish add sure when remember. Agree consumer economy under. Identify none us program not clear conference step. Somebody hospital build may property indeed always.,2020-06-18T17:21:35,followers
100171,1381,Debitis ad odio. Cum corporis esse quisquam suscipit. Accusamus nihil sint quam quo magni.,2020-10-18T06:36:41,private
100172,1425,Good only center Democrat. Chair finally price event. Information consider oil cup art. Way appear score individual available arm after.,2020-09-19T19:56:59,followers
100173,1088,Nesciunt aperiam modi dolores. Animi modi ex quasi. Fugiat delectus sequi culpa cupiditate officiis quasi nihil.,2020-10-01T03:22:54,followers
100174,1222,Enim omnis consectetur facilis. Cumque repudiandae cumque suscipit reprehenderit.,2020-01-21T07:25:16,public
100175,1053,Ipsam quasi delectus voluptates. Iusto ducimus aperiam ad pariatur.,2020-11-01T09:01:03,followers
100176,1452,Cumque minima amet illum. Accusamus laboriosam iste voluptatibus architecto modi.,2020-04-05T08:38:20,public
100177,1130,Laudantium odit eos suscipit facilis. Quas excepturi eaque temporibus laboriosam fugit culpa. Vero placeat iusto totam sapiente unde ratione.,2020-11-24T18:09:51,followers
100178,1405,Rem eaque error eaque voluptatem. Accusantium vero explicabo nisi repellat.,2020-11-04T01:58:22,followers
100179,1132,Facere assumenda aperiam fugiat repellendus temporibus accusantium. Officia repellendus voluptatum ea.,2020-11-27T09:00:13,private
