post_id,user_id,body,created_ts,visibility
101073,1496,Vero assumenda quo vero voluptatem. Aperiam numquam modi corporis. Placeat cumque quasi maiores similique.,2020-12-01T03:50:56,private
101074,1229,Cupiditate sed atque veniam aliquam sunt. Velit error in unde nemo unde. Quia eligendi eos animi veritatis.,2020-07-11T00:50:17,public
101075,1151,Main business its level position miss. Food company seat.,2020-04-21T03:01:58,private
101076,1197,Porro veritatis aperiam harum doloremque. Rem neque animi nulla minima consequuntur libero. Ea ut itaque beatae.,2020-09-05T20:39:46,public
101077,1290,Laboriosam esse sunt earum doloribus cupiditate cupiditate cum. Iste quidem voluptatem. Quod sequi natus illo animi.,2020-07-16T07:56:22,private
101078,1392,Begin sort meeting glass. Image everything assume social.,2020-09-12T15:18:55,private
101079,1203,Repellendus porro delectus commodi quia natus eius. Eum et eveniet veritatis corporis animi. Quis culpa fuga nobis porro culpa.,2020-09-25T01:01:56,private
101080,1089,Tend law trip radio. Step brother mind would security experience always.,2020-05-26T06:46:27,followers
101081,1400,Eum accusantium aut nemo.,2020-12-12T23:01:38,private
101082,1368,Nesciunt quaerat repellendus dolorum odio. Nulla sapiente quod ad.,2020-05-08T13:51:06,followers
101083,1440,Listen art city key. Ago meet skin whose.,2020-11-01T23:33:40,public
101084,1399,Temporibus ratione dolore voluptas iure ex similique. Facilis consequuntur praesentium nobis soluta facilis.,2020-07-06T05:14:14,followers
101085,1187,Suscipit explicabo natus cupiditate officia. Consequatur vitae eligendi.,2020-02-04T06:33:05,public
101086,1286,Money remember kitchen art life. These nation outside change social. Down cultural certainly capital simply save.,2020-05-31T09:59:30,public
101087,1063,Laborum culpa temporibus possimus possimus in minima quia. Commodi qui eligendi autem asperiores quae ratione. Voluptatem vero odit.,2020-09-13T20:07:42,public
101088,1295,Nisi totam nemo. Esse reprehenderit expedita repellat exercitationem nisi. Asperiores corporis modi in et.,2020-11-06T17:16:20,followers
101089,1306,Veniam blanditiis deleniti eaque voluptas vitae. Error sequi ipsam. Illo ea quidem delectus nostrum quibusdam harum fugiat. Reprehenderit possimus quis et.,2020-10-07T10:36:08,followers
101090,1234,Voluptas amet rerum fugit ipsa eum. Vitae enim repudiandae inventore nulla nesciunt nostrum praesentium. Eveniet quod porro totam ut harum natus.,2020-03-02T16:35:20,public
101091,1167,Delectus minima enim eaque nostrum veniam. Itaque officia quae animi porro ullam culpa. Molestiae distinctio distinctio a.,2020-05-09T08:00:53,private
101092,1080,Temporibus laboriosam ipsam cumque aspernatur. Asperiores fuga aliquam velit nisi. At at exercitationem optio repudiandae eaque.,2020-09-26T21:23:23,private
101093,1413,Member property book fine read treat lot. Table say black. Major section same.,2020-05-22T13:36:35,private
101094,1108,Tempore error laudantium voluptates repudiandae. Illo assumenda eum error magnam quos nam tempora. Vero voluptatibus maxime.,2020-04-25T00:33:01,public
101095,1034,Porro odio iure ex. Totam vitae unde eum.,2020-01-09T06:18:33,followers
101096,1338,Perspiciatis dolores quasi ut amet eos. Consequatur nihil dolorem minus. Eligendi dolorum similique totam laborum.,2020-02-05T05:10:58,private
101097,1050,National miss here girl never down his reality. Picture common but.,2020-04-24T18:51:11,private
101098,1119,Beat ahead high paper standard speech senior. Sound exist heart Mr.,2020-05-03T15:05:36,followers
101099,1036,Herself each cup black blood. Federal pull your before your artist give.,2020-11-09T10:05:23,private
101100,1435,Repudiandae odio numquam expedita animi iste architecto. Inventore nihil eos quam molestiae repellendus necessitatibus. Debitis a unde corrupti voluptates porro enim quis.,2020-04-18T01:02:39,followers
101101,1341,Id saepe nobis saepe occaecati ut cum commodi. Cumque magni libero nulla natus molestias deserunt hic.,2020-06-16T11:05:20,followers
101102,1091,When a together activity new federal. Eight from degree wind able class. Summer follow five.,2020-09-11T01:16:11,private
101103,1355,Difference along campaign around whom trouble rich. During door something sometimes.,2020-04-04T20:56:36,public
101104,1374,Similique reprehenderit quaerat voluptatibus fugit officiis. Accusantium cupiditate dolores aperiam. Hic amet ad odit.,2020-05-31T08:52:15,public
101105,1023,Iusto libero magnam consequatur voluptate iste. Fugit veritatis reprehenderit ut maxime fugit.,2020-07-09T02:50:28,followers
101106,1418,Omnis ex cupiditate animi.,2020-02-19T15:24:14,followers
101107,1364,Error quidem esse voluptates assumenda incidunt. Id ipsa facere quas. Mollitia eveniet saepe fugit odit.,2020-02-18T12:03:45,followers
101108,1342,Explicabo eligendi accusantium dolores esse modi. Dignissimos dolore voluptate velit dolor distinctio. Aspernatur sunt doloribus culpa harum dolor ipsum.,2020-05-04T12:47:02,followers
101109,1424,Odio minima repellat expedita animi odio. Soluta iure consequatur repudiandae iusto.,2020-04-18T06:32:15,public
101110,1489,Aliquam similique consequuntur fuga repudiandae. Voluptatibus repellendus impedit neque.,2020-11-22T19:16:43,public
101111,1342,Temporibus ipsa fugit cum. Accusamus ipsam officia consequuntur tempora cupiditate.,2020-08-17T11:39:38,public
101112,1411,Veritatis nisi corporis est veritatis omnis quo sapiente. Eaque eaque quidem illum numquam culpa.,2020-03-28T09:56:45,public
101113,1216,Voluptas animi minima officia. Quae magni enim. Recusandae minus autem debitis facere iste.,2020-04-11T23:49:15,followers
101114,1392,Odit mollitia reprehenderit omnis. Illo similique officiis quam quae.,2020-04-17T10:30:58,private
101115,1404,Dicta sit consequuntur hic porro sequi sapiente. Ad illo illum esse voluptatum assumenda quia. Sit velit cum.,2020-07-26T06:07:16,private
101116,1037,Impedit dolorem repellendus id illo voluptatum. Omnis corrupti quasi quam quae velit iusto ratione.,2020-09-17T00:53:38,followers
101117,1177,Necessitatibus minima voluptatibus ipsam nisi sint. Facilis nam ducimus delectus delectus nam.,2020-03-26T14:00:50,followers
101118,1142,Rem architecto rerum totam. Repellat dicta ratione.,2020-10-19T13:14:39,followers
101119,1198,Distinctio in aliquam repellat in. Beatae commodi accusantium officiis ratione. Ea laboriosam labore cupiditate. Quisquam minima voluptas eius.,2020-01-22T20:40:20,followers
101120,1120,Aliquam quaerat sint maxime incidunt. Numquam dicta perferendis totam necessitatibus tempore.,2020-06-15T19:40:47,public
101121,1260,Remain miss allow such expert cost Mrs eight. Dog allow record usually impact already Congress.,2020-08-28T23:16:33,private
101122,1076,Aspernatur ratione atque optio neque eos. Consectetur dolorum tenetur. Repellat pariatur dicta architecto.,2020-08-17T18:29:43,followers
101123,1009,Labore qui ad quod corrupti mollitia est. Porro eaque fuga sequi laudantium quidem amet. Numquam sapiente officiis natus quos iusto cum nemo.,2020-11-16T15:36:33,followers
101124,1310,Nostrum quos magnam quos odit assumenda sint. Quis praesentium rem sed.,2020-02-09T22:14:06,private
101125,1453,Harum fugiat ab maxime nobis alias.,2020-10-07T22:46:26,public
101126,1362,Trial media according range recognize. Top some however clear cover. Rich prevent set hundred actually financial.,2020-08-23T17:14:46,private
101127,1351,Tonight want election respond individual agency. Book one wear tough husband three.,2020-11-28T00:03:47,followers
101128,1013,Maiores laboriosam minus voluptate ut explicabo nobis.,2020-02-07T02:34:57,private
101129,1283,Officiis iure neque autem praesentium. Ipsam culpa quibusdam adipisci ad non ut.,2020-03-23T19:28:43,public
101130,1358,Purpose final tend budget. By pretty blue catch data soldier but laugh. As natural kind carry soldier west great carry.,2020-09-17T02:10:45,public
101131,1352,Ipsum quaerat molestias unde tempore odit officiis beatae. Et sit vitae temporibus. Qui natus quisquam distinctio.,2020-02-04T20:00:40,public
101132,1152,Excepturi ut nihil corporis. Quod illo voluptas pariatur est quam excepturi. Aliquid incidunt aliquam iusto vel inventore vitae.,2020-03-11T14:50:09,private
101133,1435,Error at dolores placeat deserunt alias.,2020-07-23T16:16:48,followers
101134,1474,Firm national section support present. Population become right possible thus industry member. Traditional card visit treat.,2020-03-21T00:51:12,followers
101135,1155,He stage go carry. Dog stage never.,2020-08-17T05:04:30,public
101136,1271,Tempore quidem debitis adipisci quas voluptatem. Possimus incidunt voluptas. Nam dicta reiciendis praesentium cum facere non.,2020-01-08T12:36:59,public
101137,1336,Laudantium cupiditate officiis impedit repudiandae iure dicta. Fugit minima nam quis libero maxime nisi ut. Labore esse minima quis nisi reprehenderit voluptate.,2020-11-06T06:26:38,followers
101138,1411,Aspernatur alias aliquid nam animi nisi amet. Reprehenderit dolore quaerat vitae. Distinctio sapiente quos.,2020-01-06T17:45:42,public
101139,1410,Last training election any. Hot item than look start with as.,2020-06-08T18:04:49,private
101140,1175,Recusandae totam tenetur repellendus iure. Voluptate corrupti quod.,2020-10-08T12:11:31,private
101141,1100,Vitae quisquam commodi cumque magni totam quam placeat. Dolores officiis eos natus ea. Doloribus temporibus iste aliquam.,2020-06-05T03:19:22,private
101142,1348,Nobis animi quas facere excepturi quaerat. Cum minima eligendi deleniti nesciunt ducimus fugiat. Dicta minima molestiae at eaque.,2020-01-18T07:51:09,followers
101143,1288,Eveniet nisi at magni hic ratione molestias. Quam mollitia facere.,2020-03-24T15:48:26,public
101144,1393,Ducimus debitis dolores veniam incidunt quos hic quibusdam. Quod saepe voluptatibus tempora labore deserunt distinctio.,2020-03-24T22:45:30,private
101145,1372,Sapiente minus suscipit quaerat doloribus doloremque fugiat ipsam.,2020-11-13T13:21:16,public
101146,1142,Facilis est a corrupti nostrum. Soluta eveniet nobis laborum iusto velit.,2020-01-11T11:10:44,followers
101147,1278,Rock five arrive population indicate. Cut door possible. Play money hand central present true.,2020-10-25T00:57:53,public
101148,1095,Nesciunt vero officiis eos. Saepe mollitia laudantium assumenda eos porro. Nulla minima voluptas ea a aliquam.,2020-06-04T17:03:41,public
101149,1132,Ex culpa voluptas eligendi aspernatur error deserunt laudantium. Voluptatem excepturi nesciunt impedit consequatur eum voluptate. Quasi tenetur porro provident provident vel.,2020-05-24T19:15:39,followers
101150,1242,Odit quas molestias quo voluptas occaecati recusandae repellat. Beatae deserunt laborum laboriosam.,2020-03-06T11:12:20,private
101151,1325,In modi eligendi eligendi dignissimos distinctio. Dolore facere iste. In autem suscipit molestiae. Non accusamus quo ipsam.,2020-02-27T14:56:56,followers
101152,1405,Ipsa tempore ab. Esse quisquam enim iure eaque officiis fuga.,2020-07-22T19:23:31,followers
101153,1115,Accusantium facilis doloremque vitae distinctio reiciendis. Atque numquam et delectus occaecati accusamus corporis neque. Nesciunt alias soluta doloremque laboriosam fuga.,2020-06-22T21:25:36,private
101154,1239,Nesciunt occaecati at error illum omnis a. Porro reiciendis sit.,2020-03-26T10:18:14,private
101155,1252,Id tempore officiis accusamus laboriosam doloribus eaque alias.,2020-09-20T18:55:43,public
101156,1446,Player fine yeah maintain. Night similar commercial coach.,2020-04-07T04:10:20,followers
101157,1159,Provident explicabo atque porro molestiae. Quibusdam possimus quibusdam rerum.,2020-10-30T22:32:38,followers
101158,1374,Space tough course enter fly myself. Over so behind nothing ahead yourself add. Ability Congress enough dinner.,2020-02-14T19:57:16,followers
101159,1132,Fugiat ipsum tempora delectus tenetur labore cumque. Laborum cum harum neque sequi rerum. Officia ipsa vel quisquam consectetur.,2020-10-29T16:38:34,public
101160,1086,Aut architecto assumenda itaque dicta praesentium sapiente. Dolorem officiis aut at architecto doloribus. Porro quaerat voluptas porro. Officiis facilis quisquam consequuntur nostrum.,2020-05-14T12:29:19,private
101161,1036,Veniam perferendis harum dicta inventore. Harum ullam soluta assumenda ipsam quod quis.,2020-09-24T05:34:08,public
101162,1271,Neque ea reiciendis labore harum nobis molestias.,2020-07-03T19:52:05,public
101163,1199,A magni a sunt. Ipsum magni rerum. Architecto nostrum voluptatibus beatae fuga officiis vero.,2020-02-28T02:01:50,private
101164,1338,Quae alias earum ab voluptates. Qui consequatur iure ab expedita at. Reiciendis perspiciatis magni. Quidem minima quidem adipisci.,2020-02-26T06:01:38,followers
101165,1402,Suscipit ea praesentium eaque odio. Ipsam esse aut itaque cum veniam libero.,2020-08-14T19:39:00,followers
101166,1212,Dolorum illum iure id. Laborum tempore esse delectus alias ipsum accusantium minus. Deleniti quasi fuga tempora necessitatibus esse ducimus.,2020-01-16T03:24:35,followers
101167,1176,Perferendis dolorem a provident ex quia. Ducimus harum explicabo.,2020-03-30T19:28:47,public
101168,1136,Dolore modi at ab. Dolor quasi dolorem enim est. Atque occaecati qui ex eligendi. Quam repudiandae aliquid quae deleniti dolor itaque.,2020-08-30T15:56:58,followers
101169,1148,Upon particularly face forward. North security manager hope culture.,2020-02-22T04:37:26,private
101170,1199,Where offer your enter set writer. Only low line window source least. But full I culture letter.,2020-09-01T15:53:06,followers
101171,1112,A veniam a commodi laudantium cum ad.,2020-10-05T16:04:29,followers
101172,1406,Vel eos dicta consequuntur laborum. Adipisci eligendi nam odio in fuga minus. Perspiciatis rem id blanditiis inventore quia corrupti. Eum fuga ab accusantium ipsum totam.,2020-01-12T00:49:15,public
101173,1409,Experience these onto blue finish production.,2020-04-28T22:12:11,followers
101174,1236,Ea repellendus sunt. Nam similique a tempore eligendi reprehenderit. Similique odit libero sapiente.,2020-03-22T13:06:08,private
101175,1257,Neque ducimus architecto corrupti nemo. Ullam commodi deserunt illum quos earum labore. Fugiat maiores omnis dicta eos qui.,2020-08-11T08:17:41,public
101176,1437,Esse impedit sint unde nihil amet. Explicabo corporis consectetur. Perferendis harum rem doloremque odit.,2020-02-05T07:56:59,public
101177,1475,Deleniti voluptatem aut mollitia tempora natus corrupti.,2020-07-11T06:35:40,public
101178,1300,Harum sapiente perspiciatis dicta quos. Ad exercitationem beatae dolorem similique nam.,2020-09-04T06:09:53,private
101179,1315,Consequuntur sequi vero exercitationem maxime. Maiores doloribus cum minus at possimus exercitationem. Possimus alias pariatur ad.,2020-11-02T16:42:13,private
101180,1220,Unde similique nam magnam quos alias itaque. Exercitationem eos ipsa veniam nobis ipsum. Esse possimus earum.,2020-04-24T07:11:31,followers
101181,1439,Activity well particularly hair buy keep choose could. One station attention own civil answer matter. Listen opportunity down make ever own office.,2020-04-15T15:09:06,public
101182,1255,Reiciendis laborum iusto quaerat non praesentium. Asperiores accusantium dolores laboriosam aut aspernatur illum earum. Eligendi tenetur repellendus sunt totam velit explicabo tempore.,2020-09-05T15:32:05,public
101183,1166,Minima excepturi ipsum. Reiciendis magni nulla sit. Aliquam velit amet unde magnam eius.,2020-11-09T18:03:46,private
101184,1282,Fugiat aliquid possimus dicta ea hic neque. Quidem animi assumenda impedit quo. Dolore non modi voluptatibus quidem. Eius sunt consectetur consequuntur.,2020-04-19T06:59:36,public
101185,1106,You outside place number. Class little hot. Hair system hear remember number.,2020-11-15T12:31:00,private
101186,1209,Debitis optio illo ullam ratione quam.,2020-11-11T07:40:10,private
101187,1042,Reiciendis voluptatum voluptates velit recusandae. Dolores in sed sed dolorum aliquam consectetur. Facere hic aut fugit quo quas provident tempora.,2020-02-19T03:08:06,public
101188,1200,Quisquam dolorum aperiam nisi. Iusto asperiores cumque ducimus dolores alias temporibus.,2020-05-22T20:57:33,private
101189,1481,When later between particularly can. Force road network citizen strong level wall prevent.,2020-08-24T06:45:00,public
101190,1218,Optio aperiam enim laudantium. Labore odio fugiat nesciunt et fugiat recusandae praesentium. Eaque occaecati dicta neque.,2020-01-20T14:27:40,public
101191,1348,Quos repudiandae hic labore aliquid. Iusto error ut vitae atque.,2020-09-30T11:33:49,private
101192,1128,Dolore ipsum commodi unde. Eum atque et architecto. Eum aut vitae esse eos animi quaerat nemo.,2020-05-07T22:45:03,followers
101193,1321,Nulla quidem iste ullam.,2020-08-15T15:00:47,followers
101194,1320,Provident temporibus pariatur quis magnam veritatis necessitatibus. Perferendis aliquid commodi laborum. Quia distinctio sint corrupti exercitationem praesentium quibusdam.,2020-05-17T21:03:12,private
101195,1382,Excepturi aut voluptatem reprehenderit alias hic. Quo temporibus neque autem quibusdam quam velit.,2020-05-19T21:37:01,followers
101196,1002,Distinctio porro numquam pariatur. Adipisci ea vero quo.,2020-12-05T18:51:26,public
101197,1063,Necessitatibus dolorum enim architecto architecto. Id qui facilis corrupti nihil inventore magnam.,2020-12-11T04:17:44,followers
101198,1281,Explicabo rerum maiores temporibus. Perspiciatis ipsam temporibus dignissimos magni. Harum animi accusamus harum ea.,2020-07-06T20:58:38,public
101199,1416,Tenetur minus libero ullam. Repudiandae rerum qui neque nobis. Consequatur sed voluptate eligendi vel facere.,2020-11-08T23:51:42,public
101200,1363,Explicabo quam facere. Soluta esse eaque dolore. Reiciendis distinctio doloremque ipsum enim hic quibusdam.,2020-11-24T10:50:02,followers
101201,1259,Vel quod hic eos. Beatae officiis similique dignissimos. Quisquam beatae aperiam ipsum aperiam.,2020-09-22T05:26:52,public
101202,1496,Consequatur excepturi possimus molestias quia autem. Aperiam architecto cupiditate. Sequi iure impedit excepturi ad.,2020-02-09T00:28:01,public
101203,1334,Carry can two until. Spend myself attorney husband smile. Story which side power.,2020-09-18T22:53:29,private
101204,1219,Quibusdam enim perferendis ullam explicabo accusamus.,2020-07-06T16:39:49,followers
101205,1371,Dignissimos odit vero assumenda aspernatur sed dolores. Id accusantium optio architecto delectus. Quibusdam dicta molestiae aperiam eligendi sed.,2020-07-16T05:15:19,followers
101206,1403,Deal former note suddenly individual. Play before father although together see walk.,2020-11-26T16:02:06,private
101207,1122,Et aliquam aliquid eaque dignissimos. Ea alias eum provident. Libero magni maxime impedit error dolores necessitatibus.,2020-07-18T11:19:23,public
101208,1194,Magni adipisci dignissimos ea deserunt a doloremque exercitationem. Maiores aliquam tempora harum. Facilis illum earum enim ipsum.,2020-08-25T00:48:44,followers
101209,1259,A delectus harum iure voluptatibus temporibus nostrum. Sed porro magnam voluptates. Id veritatis fugit voluptatum nostrum nostrum illo natus. Ad incidunt quae sint.,2020-03-26T20:24:58,public
101210,1140,Architecto iure ipsa. Beatae nihil provident perferendis pariatur eveniet.,2020-01-21T19:08:39,private
101211,1240,Et inventore ratione iusto quisquam magni quos. Nesciunt maxime dolor culpa consectetur itaque aliquam.,2020-02-16T00:05:18,followers
101212,1231,Fugiat at accusantium delectus nesciunt. Iusto iste tenetur ratione. Sequi expedita illo unde dolores quia temporibus.,2020-05-30T01:36:42,private
101213,1208,Illo dolore dolore. Exercitationem fugiat corporis dolores ratione.,2020-05-02T16:11:01,private
101214,1212,Quaerat id fugiat necessitatibus iure natus labore incidunt. Ut eius a vero.,2020-11-11T09:36:30,private
101215,1440,Error ab ipsum reiciendis. Amet labore ipsam quas est. Error pariatur dolorem a.,2020-11-25T13:56:10,public
101216,1215,Omnis facilis perspiciatis blanditiis laboriosam asperiores culpa magnam. Eaque quae quae minima sed aut cupiditate.,2020-04-04T04:16:11,followers
101217,1327,Morning wind yet event voice him. International push push security. Pay authority and.,2020-02-03T15:00:53,followers
101218,1317,Office card defense civil in heavy. Fact billion red.,2020-10-28T03:58:20,public
101219,1150,Painting by civil finally wish assume. Leader degree team hair wife training stage. Pull blood position family various goal.,2020-06-07T13:19:24,private
101220,1205,Dolorum minus optio commodi. Aut voluptate odit veritatis perferendis. Labore excepturi aperiam autem accusantium eos impedit. Blanditiis modi at corporis tempora consequatur.,2020-06-20T10:33:47,private
101221,1234,Quis aliquam praesentium est unde nam sit quidem. Tempora culpa quaerat praesentium ad quas ab id.,2020-06-18T20:39:27,private
101222,1339,Find sure anything people blood debate.,2020-09-17T13:00:33,followers
101223,1449,That condition fight relate within word ready. Member between education claim civil life morning whose. Issue usually option we size.,2020-07-02T13:44:28,private
101224,1210,Assumenda ullam ad aut sint perspiciatis minus aut. Commodi ipsa animi facilis.,2020-10-17T18:15:57,followers
101225,1080,Corrupti eum officia totam aliquid a quasi dolor. Repellendus dignissimos nihil dolor voluptate. Animi perspiciatis animi nihil pariatur fuga.,2020-07-24T19:01:06,private
101226,1277,Libero aut aspernatur ipsa omnis facere assumenda deserunt. Unde sint sapiente quidem. Ab libero quia delectus sunt ipsa omnis.,2020-04-04T19:00:54,followers
101227,1479,Vitae exercitationem amet sunt illo tempora perferendis. Accusamus at optio.,2020-06-28T08:46:34,private
101228,1332,Picture upon simple might until discover.,2020-11-24T08:22:52,public
101229,1216,Unde sint temporibus dolorum. Modi tempora iure illo sunt ad voluptatum harum.,2020-09-23T22:48:33,public
101230,1340,Autem vero dignissimos. Iure cum maiores amet recusandae. Esse ipsam officia minima molestiae quia.,2020-08-27T13:34:32,followers
101231,1237,Ab cupiditate modi soluta sunt enim. Quod ad dicta a non dolor illum. Harum est ipsam incidunt sunt quo ipsum.,2020-12-27T12:44:56,private
101232,1125,Aliquid nisi dolores soluta repellendus itaque consequuntur. Animi cum ipsum nisi.,2020-08-30T08:06:18,public
101233,1486,Voluptates aut porro praesentium amet vero. Nisi in totam iste modi.,2020-11-21T03:18:08,private
101234,1312,Contain great direction bar land course main. Mission expect behavior peace address. Picture walk hour brother recently media size along.,2020-04-18T15:03:37,private
101235,1191,Similique dolorum explicabo exercitationem. Cumque natus debitis. Aspernatur numquam debitis.,2020-07-17T00:04:26,public
101236,1167,Eum eligendi laudantium dolores. Perspiciatis dolores ducimus animi dignissimos quas neque. Autem voluptas atque nam deserunt. Eligendi autem consectetur.,2020-03-11T05:03:06,public
101237,1331,Voluptas molestias voluptate.,2020-03-07T20:10:45,followers
101238,1021,Why certain now child even actually total. Also wife school plant bed number. Reach follow interesting other.,2020-12-30T23:34:58,private
101239,1038,Assumenda quisquam in reiciendis officiis quis. Amet natus harum. Dolor fugit consectetur quam autem animi nesciunt. Quam ab laborum ullam tempora.,2020-06-18T08:11:39,public
101240,1118,Voluptatum sequi veniam blanditiis quos placeat. Beatae aliquam doloribus aperiam. Aut quos ipsam laudantium optio omnis animi.,2020-11-24T11:00:19,followers
101241,1421,Reprehenderit illo minus. Non in occaecati fugiat consequatur ab delectus.,2020-01-03T13:31:46,followers
101242,1250,Eius impedit nulla dolore deleniti eligendi consequuntur.,2020-03-06T14:17:42,private
101243,1253,Leave few call whole style either. Son really herself thought whom place read. Interest that save dream.,2020-03-04T18:37:52,followers
101244,1177,Quam nulla quibusdam rerum necessitatibus harum eligendi. Nobis suscipit quasi molestias harum ipsa quos.,2020-12-18T07:41:27,private
101245,1341,Tempore exercitationem quam corrupti hic reprehenderit. Tempore repudiandae facere fuga nisi quisquam esse. Iste consectetur rerum assumenda magni quisquam aliquid. Neque ipsa autem molestiae.,2020-04-03T08:14:36,followers
101246,1237,Minima totam possimus delectus est amet eaque. Quos dolore maiores labore.,2020-02-28T17:29:22,followers
101247,1383,Repellat libero aliquam laborum. Ea quasi enim doloremque ipsum sit beatae vitae. Est ipsum dignissimos. Omnis necessitatibus aliquam accusamus.,2020-02-05T22:44:48,private
101248,1179,Nihil reprehenderit qui voluptatibus ipsum. In molestias architecto magni doloribus facilis. Necessitatibus atque sequi veritatis earum magnam recusandae. Nam dicta explicabo commodi incidunt ab.,2020-06-12T21:18:58,followers
101249,1482,Enter show result public put wall may. Hand office information into exist.,2020-06-07T17:16:21,followers
101250,1303,Porro ipsam porro vitae nisi ad. Tempora eius corrupti.,2020-10-29T23:59:17,private
101251,1104,Eos rem sit tempora omnis. Ullam officiis delectus.,2020-10-25T06:34:49,private
101252,1240,Iusto totam aliquam hic blanditiis voluptates voluptas. Ut adipisci doloremque corrupti quas. Rerum facere amet sed corrupti hic pariatur quos. Quis occaecati asperiores optio sint.,2020-08-11T20:26:25,private
101253,1369,Ab voluptate libero animi commodi dolorem odit. Odio sapiente cumque quisquam provident possimus nesciunt. Deleniti quisquam sit nam est.,2020-07-09T20:39:02,public
101254,1409,Doloremque suscipit magni doloribus. Nisi aspernatur ipsum aut.,2020-10-16T13:37:12,public
101255,1018,Exercitationem repellendus voluptas dolore nisi alias. Sit culpa ratione iure dolor voluptatem perferendis. Maxime quas similique consequuntur non quos ex dolorum.,2020-12-23T17:43:08,followers
